codigo,nome,uf,indicador
394460043975,MINISTERIO DA ECONOMIA,DF,NÃO CONTRIBUINTE
10779511000298,INSTITUTO FEDERAL DE ED. CIENCIA E TEC. FLUMINENSE,RJ,CONTRIBUINTE ISENTO
4079233000182,LABORATORIO NACIONAL DE COMPUTACAO CIENTIFICA,RJ,NÃO CONTRIBUINTE
394494004042,SUPERINTENDENCIA DO DEP.DE POL.FED.SP,SP,NÃO CONTRIBUINTE
7526983003754,SUPERINT. REG. DO TRAB. E EMPR. EM SAO PAULO-SRTE/SP,SP,NÃO CONTRIBUINTE
394460012310,MINISTERIO DA ECONOMIA,SP,NÃO CONTRIBUINTE
42414284001346,COLEGIO PEDRO II,RJ,NÃO CONTRIBUINTE
396895002845,MINIST DA AGRIC PECUARIA E ABASTECIMENTO SUP FEDERAL EST SP,SP,NÃO CONTRIBUINTE
1263896003341,MINISTERIO DA CIENCIA TECNOLOGIA INOVACOES E COMUNICACOES,DF,NÃO CONTRIBUINTE
3568867000136,HOSPITAL DAS FORCAS ARMADAS,DF,NÃO CONTRIBUINTE
394536001291,MINISTERIO DAS RELACOES EXTERIORES,DF,NÃO CONTRIBUINTE
396895001016,MINISTERIO DA AGRICULTURA PEACUARIA E ABASTECIMENTO,DF,CONTRIBUINTE ISENTO
24098477000110,UNIVERSIDADE FEDERAL DA PARAIBA,PB,NÃO CONTRIBUINTE
7518297000120,CENTRO INTEGRADO DE TELEMATICA DO EXERCI,DF,NÃO CONTRIBUINTE
5914685000103,CONTROLADORIA GERAL DA UNIAO,DF,NÃO CONTRIBUINTE
394544005063,MINISTERIO DA SAUDE,MT,CONTRIBUINTE ISENTO
5756246000454,SUBSECRETARIA DE ASSUNTOS ADMINISTRATIVOS DO MINIS. DA CIDAD,DF,NÃO CONTRIBUINTE
394544003605,MINISTERIO DA SAUDE,MT,NÃO CONTRIBUINTE
394544004504,MINISTERIO DA SAUDE,MT,NÃO CONTRIBUINTE
394544017150,MIN DA SAUDE - INST NACIONAL DO CANCER,RJ,NÃO CONTRIBUINTE
95591764000105,UNIVERSIDADE FEDERAL DE SANTA MARIA,RS,CONTRIBUINTE ICMS
10783898000175,INSTITUTO FEDERAL DE EDUCACAO CIENCIA E,PB,NÃO CONTRIBUINTE
7549168000108,2º BATALHAO DE ENGENHARIA DE CONSTRUCAO,PI,CONTRIBUINTE ISENTO
75095679000149,UNIVERSIDADE FEDERAL DO PARANA,PR,CONTRIBUINTE ISENTO
17220203000196,CENTRO FEDERAL DE EDUCACAO TECNOLOGICA DE MINAS GERAIS,MG,NÃO CONTRIBUINTE
42414284000102,COLEGIO PEDRO II,RJ,CONTRIBUINTE ISENTO
9576937000184,COMANDO DA 4A REGIAO MILITAR,MG,NÃO CONTRIBUINTE
38166000105,BANCO CENTRAL DO BRASIL,DF,NÃO CONTRIBUINTE
9561263000225,HOSPITAL DE GUARNICAO DE SAO GABRIEL DA CACHOEIRA,AM,CONTRIBUINTE ISENTO
9234494000143,SECRETARIA ESPECIAL DE COMUNICACAO SOCIAL,DF,NÃO CONTRIBUINTE
34023077000107,UNIVERSIDADE FEDERAL DO ESTADO DO RIO DE JANEIRO,RJ,NÃO CONTRIBUINTE
32479164000130,HOSPITAL UNIVERSITARIO CASSIANO ANTONIO MORAES,ES,NÃO CONTRIBUINTE
59311002099,FUNDACAO NACIONAL DO INDIO (CFPE URU EU WAU WAU),RO,NÃO CONTRIBUINTE
10637926001207,INSTITUTO FEDERAL DO RS / CAMPUS IBIRUBA,RS,NÃO CONTRIBUINTE
9595355000145,1 BATALHAO DE INFANTARIA DE SELVA (AEROMOVEL),AM,NÃO CONTRIBUINTE
9590085000180,7 BATALHAO DE ENGENHARIA DE COMBATE,RN,NÃO CONTRIBUINTE
9665038000239,COMANDO DE ARTILHARIA DIVISIONARIA DA 1 DIVISÃO DE EXÉRCITO,RJ,CONTRIBUINTE ISENTO
394494001027,DELEMIG DREX SR DPF AP,AP,NÃO CONTRIBUINTE
59311000983,FUNDACAO NACIONAL DO INDIO,MT,NÃO CONTRIBUINTE
9569314000184,COMANDO/1A BRIGADA DE INFANTARIA DE SELVA,RR,NÃO CONTRIBUINTE
9569314000265,COMANDO DA 1 BRIGADA DE INFANTARIA DE SELVA,RR,NÃO CONTRIBUINTE
402552000550,INSTITUTO DE PESQUISAS ENERGETICAS E NUCLEARES,SP,NÃO CONTRIBUINTE
4071106000137,UNIVERSIDADE FEDERAL DO ACRE,AC,NÃO CONTRIBUINTE
394494002856,SUPERINTENDENCIA REGIONAL DO DPF EM MATO GROSSO,MT,NÃO CONTRIBUINTE
33781055000216,INSTITUTO NACIONAL SAUDE MULHER CRIANCA ADOLECENTE-FF,RJ,NÃO CONTRIBUINTE
394544021182,MINISTERIO DA SAUDE,RJ,NÃO CONTRIBUINTE
394429003045,COMANDO DA AERONAUTICA,SP,NÃO CONTRIBUINTE
25944455000196,UNIVERSIDADE FEDERAL DE VICOSA,MG,NÃO CONTRIBUINTE
394429001182,BASE AEREA DO GALEÃO - ALA 11,RJ,NÃO CONTRIBUINTE
5526783000165,MINISTERIO DA CIDADANIA,DF,NÃO CONTRIBUINTE
394429017771,GRUPAMENTO DE APOIO DO DISTRITO FEDERAL,DF,NÃO CONTRIBUINTE
10791831000506,INSTITUTO FEDERAL DE EDUCACAO CIENCIA E TECNOLOGIA DE BRASIL,DF,NÃO CONTRIBUINTE
394429005927,GRUPAMENTO DE APOIO DE BRASILIA,DF,NÃO CONTRIBUINTE
394429005765,GABINETE DO COMANDANTE DA AERONAUTICA,DF,CONTRIBUINTE ISENTO
29406625000130,AGENCIA NACIONAL DE MINERACAO,DF,NÃO CONTRIBUINTE
394429010769,HOSPITAL DE FORCA AEREA DO GALEAO,RJ,NÃO CONTRIBUINTE
394460052702,MINISTERIO DA ECONOMIA,SP,NÃO CONTRIBUINTE
60453032000174,UNIVERSIDADE FEDERAL DE SAO PAULO - UNIFESP,SP,CONTRIBUINTE ICMS
394460036413,SECRETARIA  DA RECEITA FEDERAL DO BRASIL - ALFANDEGA - PORTO,SP,CONTRIBUINTE ISENTO
396895006247,MINISTERIO DA AGRICULTURA PECUARIA E ABASTECIMENTO,MG,NÃO CONTRIBUINTE
10735145002480,INSTITUTO FEDERAL DE EDUCACAO CIENCIAE TECNOLOGIA DO MARANHA,MA,NÃO CONTRIBUINTE
9595886000138,COMANDO DA 4A BDA DE INF LEVE MONTANHA,MG,NÃO CONTRIBUINTE
33787094004480,INSTITUTO BRASILEIRO DE GEOGRAFIA E ESTATISTICA IBGE,TO,NÃO CONTRIBUINTE
17217985001852,UNIVERSIDADE FEDERAL DE MINAS GERAIS,MG,NÃO CONTRIBUINTE
9601850000209,HOSPITAL MILITAR DE AREA DE MANAUS,AM,NÃO CONTRIBUINTE
26989350002321,FUNDACAO NACIONAL DE SAUDE,PR,NÃO CONTRIBUINTE
10172061000190,2° CENTRO DE GEOINFORMACAO,DF,CONTRIBUINTE ISENTO
9634666000176,BATALHÃO DE GUARDA PRESIDENCIAL,DF,CONTRIBUINTE ISENTO
394452055188,COMANDO DO EXERCITO  - CENTRO DE INTELIGENCIA DO EXERCITO (C,DF,NÃO CONTRIBUINTE
394429001000,COMANDO DA AERONAUTICA,CE,NÃO CONTRIBUINTE
9688074000137,ESCOLA DE COMANDO E ESTADO MAIOR DO EXERCITO,RJ,NÃO CONTRIBUINTE
10495077000133,COMANDO DA SEXTA REGIAO MILITAR,BA,CONTRIBUINTE ISENTO
15461510000133,UFMS - FUNDAÇÃO UNIVERSIDADE FEDERAL DE MATO GROSSO DO SUL,MS,NÃO CONTRIBUINTE
11234780000150,UNIVERSIDADE FEDERAL DA FRONTEIRA SUL UFFS,SC,CONTRIBUINTE ISENTO
394429017852,COMANDO DA AERONAUTICA,GO,NÃO CONTRIBUINTE
10648539000881,INST. FED. SUL DE MINAS GERAIS CAMPUS POUSO ALEGRE,MG,CONTRIBUINTE ISENTO
4074457000100,CETEM CENTRO DE TECNOLOGIA MINERAL,RJ,CONTRIBUINTE ISENTO
10735145000275,INSTITUTO FEDERAL DO MARANHAO CAMPUS PINHEIRO,MA,CONTRIBUINTE ISENTO
10439707000233,CENTRO DE CAP.FISIC.DO EXERCIT. FORT.SAO JOAO - CCFEX,RJ,CONTRIBUINTE ISENTO
29979036116289,INSTITUTO NACIONAL DO SEGURO SOCIAL,SC,NÃO CONTRIBUINTE
9620754000119,1 BATALHAO DE ENGENHARIA DE COMBATE ( ESCOLA) - BATALHAO VIL,RJ,CONTRIBUINTE ISENTO
33781055001530,INSTITUTO DE TECNOLOGIA DE IMUNOBIOLOGICOS - BIO MANGUINHOS,RJ,CONTRIBUINTE ICMS
29979036116017,INSTITUTO NACIONAL DO SEGURO SOCIAL - INSS SP,SP,NÃO CONTRIBUINTE
394544006701,DISTRITO SANITARIO ESPECIAL INDIGENA MEDIO SOLIMOES,AM,NÃO CONTRIBUINTE
9590648000130,9 BATALHAO DE INFANTARIA MOTORIZADO,RS,NÃO CONTRIBUINTE
8711015000170,INSTITUTO MILITAR DE ENGENHARIA INSTITUTO MILITAR DE ENGENHA,RJ,NÃO CONTRIBUINTE
10626896001730,INSTITUTO FEDERAL DE EDUCACAO CIENCIA E TECNOLOGIA DE MINAS,MG,NÃO CONTRIBUINTE
33663683003646,CENTRO CIENC MATEMAT E DA NATUREZA DA UFRJ,RJ,CONTRIBUINTE ISENTO
10207029000100,COMANDO DO COMANDO MILITAR DA AMAZONIA,AM,NÃO CONTRIBUINTE
33663683007048,UNIVERSIDADE FEDERAL DO RIO DE JANEIRO/,RJ,NÃO CONTRIBUINTE
394429020560,COMANDO DA AERONAUTICA,RN,NÃO CONTRIBUINTE
394544020291,MINISTERIO DA SAUDE,RJ,NÃO CONTRIBUINTE
394429011064,COMANDO DA AERONAUTICA - COD. 0152265,RJ,NÃO CONTRIBUINTE
31543958000152,BASE ADMINISTRATIVA DO CURADO,PE,NÃO CONTRIBUINTE
9547338000132,7° DEPOSITO DE SUPRIMENTO,PE,CONTRIBUINTE ISENTO
9645528000192,14O BATALHAO DE INFANTARIA MOTORIZADO/PE,PE,NÃO CONTRIBUINTE
9577422000107,HOSPITAL MILITAR DE AREA DE RECIFE,PE,NÃO CONTRIBUINTE
9598288000112,COMANDO 7 REGIAO MILITAR,PE,NÃO CONTRIBUINTE
9572828000199,COMANDO DA 12 BRIGADA DE INFANTARIA LEVE (AEROMOVEL)(00693),SP,CONTRIBUINTE ISENTO
10838653001331,INST.FEDERAL ESPIRITO SANTO/CAMPUS V.N DO IMIGRANTE,ES,CONTRIBUINTE ISENTO
9560963000114,COMANDO DA 10ª REGIAO MILITAR,CE,CONTRIBUINTE ISENTO
9583415000100,COMISSAO REGIONAL DE OBRAS/12,AM,NÃO CONTRIBUINTE
9601850000110,HOSPITAL MILITAR DE AREA DE MANAUS,AM,NÃO CONTRIBUINTE
9651520000139,CENTRO DE INSTRUÇAO DE GUERRA NA SELVA,AM,CONTRIBUINTE ISENTO
7624790000125,COMANDO DO 2 GRUPAMENTO DE ENGENHARIA,AM,NÃO CONTRIBUINTE
9616768000240,HOSPITAL GERAL DE BELEM,PA,NÃO CONTRIBUINTE
10744098000226,INSTITUTO FEDERAL DO CEARA CAMPUS FORTALEZA,CE,NÃO CONTRIBUINTE
10744098001036,IFCE - CAMPUS CRATO,CE,CONTRIBUINTE ICMS
9621924000180,10 DEPOSITO DE SUPRIMENTO,CE,NÃO CONTRIBUINTE
10735145001085,INSTITUTO FEDERAL DO MARANHAO - CAMPUS CODO,MA,CONTRIBUINTE ISENTO
10626896001225,IFMG CAMPUS CONSELHEIRO LAFAIETE,MG,NÃO CONTRIBUINTE
4892707001697,DNIT-DEPARTAMENTO NACIONAL DE INFRAESTRUTURA DE TRANSPO,CE,CONTRIBUINTE ISENTO
59311007058,FUNDACAO NACIONAL DO INDIO,CE,NÃO CONTRIBUINTE
5055128000257,HOSPITAL UNIVERSITARIO ALCIDES CARNEIRO UFCG,PB,NÃO CONTRIBUINTE
10295746000204,HOSPITAL DE GUARNICAO DE NATAL,RN,NÃO CONTRIBUINTE
394460046567,MINISTERIO DA ECONOMIA,RN,NÃO CONTRIBUINTE
24365710000183,UNIVERSIDADE FEDERAL DO RIOGRANDE DO ...,RN,NÃO CONTRIBUINTE
10295746000123,HOSPITAL DE GUARNIÇÃO DE NATAL,RN,NÃO CONTRIBUINTE
7541172000111,COMANDO DO 1 GRUPAMENTO DE ENGENHARIA,PB,NÃO CONTRIBUINTE
9544418000134,HOSPITAL DE GUARNICAO DE JOAO PESSOA,PB,NÃO CONTRIBUINTE
9583579000137,COMANDO DA 7 BRIGADA DE INFANTARIA MOTORIZADA,RN,NÃO CONTRIBUINTE
24134488000108,UNIVERSIDADE FEDERAL DE PERNAMBUCO,PE,NÃO CONTRIBUINTE
24134488000299,UNIVERSIDADE FEDERAL DE PERNAMBUCO,PE,NÃO CONTRIBUINTE
9534290000128,71 BATALHO DE INFANTARIA MOTORIZADO,PE,NÃO CONTRIBUINTE
9577422000280,HOSPITAL MILITAR DE AREA DE RECIFE,PE,NÃO CONTRIBUINTE
15180714000520,UNIVERSIDADE FEDERAL DA BAHIA / COMPLEXO HOSPITALAR E DE SAU,BA,NÃO CONTRIBUINTE
9572327000293,22 BATALHAO LOGISTICO LEVE,SP,CONTRIBUINTE ISENTO
9586718000267,5 BATALHAO DE ENGENHARIA DE COMBATE BLINDADO,SC,NÃO CONTRIBUINTE
9634666000257,BATALHAO DA GUARDA PRESIDENCIAL,DF,NÃO CONTRIBUINTE
394494002937,POSTO UAI MONTES CLAROS/MG,MG,NÃO CONTRIBUINTE
9567370000260,4. BATALHAO DE ENG. DE COMBATE,MG,NÃO CONTRIBUINTE
31724933000155,UFES - COORDENACAO DE ADMN SUL ESPIRITO SANTO,ES,NÃO CONTRIBUINTE
9662517000110,VIGESIMO BATALHAO DE INFANTARIA BLINDADO 00020394,PR,NÃO CONTRIBUINTE
9632026000127,COMANDO DA 18 BRIGADA DE INF FRONTEIRA,MS,NÃO CONTRIBUINTE
9636761000109,5 COMPANHIA DE COMUNICACOES BLINDADA,PR,CONTRIBUINTE ISENTO
92242080000100,UNIVERSIDADE FEDERAL DE PELOTAS,RS,NÃO CONTRIBUINTE
394544004920,DISTRITO SANITARIO ESP INDIGENA DE MG E ES,MG,NÃO CONTRIBUINTE
394544010652,DISTRITO SANITARIO ESPECIAL INDIGENA MARANHAO,MA,CONTRIBUINTE ISENTO
10727655000381,INSTITUTO FEDERAL DE EDUCAO CIENCIA E,MG,CONTRIBUINTE ICMS
4892707002405,DNIT-DEP NAC DE INFR DE TRANSP,MG,NÃO CONTRIBUINTE
7565863000155,2º BATALHAO FERROVIARIO,MG,CONTRIBUINTE ISENTO
9643858000149,17 BATALHAO LOGISTICO,MG,NÃO CONTRIBUINTE
3510668000177,COLEGIO MILITAR DE JUIZ DE FORA,MG,NÃO CONTRIBUINTE
32479123000143,UNIVERSIDADE FEDERAL DO ESP.SANTO,ES,NÃO CONTRIBUINTE
9576726000141,38 BATALHAO DE INFANTARIA,ES,CONTRIBUINTE ISENTO
17217985002743,UNIVERSIDADE FEDERAL DE MINAS GERAIS,MG,NÃO CONTRIBUINTE
8829974000275,INSTITUTO CHICO MENDES DE CONSERVACAO DA BIODIVERSIDADE,PI,NÃO CONTRIBUINTE
10651417000178,INSTITUTO FEDERAL GOIANO,GO,NÃO CONTRIBUINTE
10727655000462,"INSTITUTO FEDERAL DE EDUCACAO, CIENCIA E TECNOLOGIA DO NORTE",MG,NÃO CONTRIBUINTE
10767239000730,INSTITUTO FEDERAL DE PERNAMBUCO - CAMPUS PESQUEIRA,PE,NÃO CONTRIBUINTE
10870883001540,"INSTITUTO FEDERAL DE EDUCACAO, CIENCIA E TECNOLOGIA DE GOI",GO,NÃO CONTRIBUINTE
8635952000193,CENTRO TECNOLOGICO DO EXERCITO - C25,RJ,NÃO CONTRIBUINTE
9647624000250,HOSPITAL DE GUARNICAO DE ALEGRETE,RS,NÃO CONTRIBUINTE
394544021344,INSTITUTO NACIONAL DE CARDIOLOGIA-INC,RJ,NÃO CONTRIBUINTE
9561190000190,ACADEMIA MILITAR DAS AGULHAS NEGRAS,RJ,NÃO CONTRIBUINTE
9687482000174,CENTRO DE AVALIACAO DO EXERCITO,RJ,NÃO CONTRIBUINTE
15180714000104,UNIVERSIDADE FEDERAL DA BAHIA,BA,NÃO CONTRIBUINTE
9549096000205,COLEGIO MILITAR DE CAMPO GRANDE,MS,NÃO CONTRIBUINTE
10763998001101,INSTITUTO FEDERAL DE EDUCACAO CIENCIAE TECNOLOGIA DO PARA,PA,NÃO CONTRIBUINTE
394544020372,MS HOSPITAL FEDERAL CARDOSO FONTES,RJ,CONTRIBUINTE ISENTO
9543601000115,ESCOLA DE INSTRUCAO ESPECIALIZADA,RJ,NÃO CONTRIBUINTE
9591608000293,HOSPITAL MILITAR DE AREA DE SAO PAULO,SP,NÃO CONTRIBUINTE
9631134000266,T9547  - HOSPITAL GERAL DE JUIZ DE FORA,MG,NÃO CONTRIBUINTE
33663683006238,FORUM DE CIENCIA E CULTURA DA UFRJ,RJ,CONTRIBUINTE ICMS
9663992000101,CENTRO DE PREPARACAO OFICIAIS RESERVA/RJ,RJ,CONTRIBUINTE ISENTO
33663683000892,ESCOLA DE QUIMICA UFRJ LABCOM,RJ,NÃO CONTRIBUINTE
10783898000256,IFPB CAMPUS JOAO PESSOA,PB,NÃO CONTRIBUINTE
33663683005347,UNIVERSIDADE FEDERAL DO RIO DE JANEIRO,RJ,NÃO CONTRIBUINTE
28523215003989,UNIVERSIDADE FEDERAL FLUMINENSE,RJ,NÃO CONTRIBUINTE
394429018077,COMANDO DA AERONAUTICA (14641),SP,NÃO CONTRIBUINTE
394429009752,COMANDO DA AERONAUTICA,SP,NÃO CONTRIBUINTE
394429000291,COMANDO DA AERONAUTICA,SP,NÃO CONTRIBUINTE
394429016457,GRUPAMENTO DE APOIO DE SAO JOSE DOS CAMPOS,SP,NÃO CONTRIBUINTE
21195755000169,UNIVERSIDADE FEDERAL DE JUIZ DE FORA UFJF,MG,CONTRIBUINTE ISENTO
33781055001298,INSTITUTO OSWALDO CRUZ,RJ,NÃO CONTRIBUINTE
9572391000193,37 BATALHAO DE INFATARIA LEVE,SP,NÃO CONTRIBUINTE
10651417000500,"INSTITUTO FEDERAL DE EDUCACAO, CIENCIA E TECNOLOGIA GOIANO",GO,NÃO CONTRIBUINTE
9551850000152,SETIMO REGIMENTO DE CAVALARIA MECANIZADO,RS,NÃO CONTRIBUINTE
9545291000178,QUINTO REGIMENTO DE CAVALARIA MECANIZADO,RS,NÃO CONTRIBUINTE
9559822000181,ESCOLA PREPARATORIA DE CADETES DO E,SP,CONTRIBUINTE ISENTO
10651417001220,INSTITUTO FEDERAL GOIANO - CAMPUS CAMPOS BELOS,GO,NÃO CONTRIBUINTE
9565807000146,32º BATALHAO DE INFANTARIA  LEVE-MONTANHA,RJ,CONTRIBUINTE ISENTO
662270000320,INST. NAC. DE METROLOGIA QUALIDADE E TECNOLOGIA - INMETRO,RJ,CONTRIBUINTE ISENTO
7722779000289,FUNDACAO UNIVERSIDADE FEDERAL DO ABC - UFABC,SP,CONTRIBUINTE ICMS
17217985004282,UNIVERSIDADE FEDERAL DE MINAS GERAIS,MG,CONTRIBUINTE ICMS
38174000496,FUNDACAO UNIVERSIDADE DE BRASILIA,DF,CONTRIBUINTE ICMS
9575381000101,BASE ADMINISTRATIVA DA GUARNICAO DE SANTA MARIA,RS,NÃO CONTRIBUINTE
75095679000220,UNIVERSIDADE FEDERAL DO PARANA,PR,NÃO CONTRIBUINTE
75101873000432,UNIVERSIDADE TECNOLOGICA FEDERAL DO PARANA - CAMPUS PATO BRA,PR,NÃO CONTRIBUINTE
10652179001863,INSTITUTO FEDERAL DE EDUCACAO CIENCIAE TECNOLOGIA DO PARANA,PR,NÃO CONTRIBUINTE
10342197000109,5 BATALHAO DE SUPRIMENTOS,PR,CONTRIBUINTE ISENTO
33787094001979,IBGE,PR,CONTRIBUINTE ISENTO
10651417001140,INSTITUTO FEDERAL GOIANO - CAMPUS POSSE,GO,NÃO CONTRIBUINTE
9587107000152,HOSPITAL DE GUARNICAO DE FLORIANOPOLIS,SC,CONTRIBUINTE ISENTO
394429018409,GRUPAMENTO DE APOIO DE SANTA MARIA,RS,NÃO CONTRIBUINTE
35840659000130,UNIVERSIDADE FEDERAL DE JATAI,GO,NÃO CONTRIBUINTE
10744098000145,"INSTITUTO FEDERAL DE EDUCACAO, CIENCIA E TECNOLOGIA DO CEARA",CE,NÃO CONTRIBUINTE
75101873000351,UNIVERSIDADE TECNOLOGICAFEDERAL DO PARANA,PR,NÃO CONTRIBUINTE
75101873001161,UNIVERSIDADE TECNOLOGICA FEDERAL DO PARANA,PR,NÃO CONTRIBUINTE
10744098003160,"INSTITUTO FEDERAL DE EDUCACAO, CIENCIA E TECNOLOGIA DO CEARA",CE,NÃO CONTRIBUINTE
9586047000153,22º GRUPO DE ARTILHARIA DE CAMAPNHA AUTOPROPULSADO,RS,NÃO CONTRIBUINTE
9566074000164,8 REGIMENTO DE CAVALARIA MECANIZADO.,RS,NÃO CONTRIBUINTE
9596556000167,COMANDO 2 BRIGADA DE CAVALARIA MECANIZADA,RS,CONTRIBUINTE ISENTO
9584407000188,SEXTO GRUPO DE ARTILHARIA DE CAMPANHA,RS,CONTRIBUINTE ISENTO
9605231000284,HOSPITAL GERAL DE SANTA MARIA,RS,NÃO CONTRIBUINTE
8829974002561,INSTITUTO CHICO MENDES DE CONSERVACAO DA BIODIVERSIDADE,RJ,CONTRIBUINTE ISENTO
394429001697,BASM - BASE AEREA DE SANTA MARIA,RS,NÃO CONTRIBUINTE
34621748000123,UNIVERSIDADE FEDERAL DO PARA,PA,NÃO CONTRIBUINTE
396895007138,"MINISTERIO DA AGRICULTURA, PECUARIA E ABASTECIMENTO",PE,NÃO CONTRIBUINTE
394429001859,BASE AEREA DE NATAL - ALA 10,RN,NÃO CONTRIBUINTE
394429000887,COMANDO DA AERONAUTICA DE CANOAS - BACO,RS,NÃO CONTRIBUINTE
10199860000150,BASE ADMINISTRATIVA DO COMANDO DE OPERACOES ESPECIAIS,GO,CONTRIBUINTE ISENTO
9539711000103,HOSPITAL MILITAR DE AREA DE CAMPO GRANDE,MS,NÃO CONTRIBUINTE
394460006506,MINISTERIO DA ECONOMIA- MT,MT,NÃO CONTRIBUINTE
10784782001394,INSTITUTO FEDERAL DE MATO GROSSO 5080,MT,NÃO CONTRIBUINTE
394429017429,COMANDO DA AERONAUTICA,RJ,NÃO CONTRIBUINTE
394445000365,MINISTERIO DA EDUCACAO,DF,CONTRIBUINTE ISENTO
33787094000140,IBGE,RJ,NÃO CONTRIBUINTE
2030715000112,AGENCIA NACIONAL DE TELECOMUNICACOES,DF,CONTRIBUINTE ISENTO
2313673000208,"AGENCIA NACIONAL DO PETROLEO, GAS NATURA",DF,NÃO CONTRIBUINTE
2270669000129,AGENCIA NACIONAL DE ENERGIA ELETRICA - ANEEL,DF,NÃO CONTRIBUINTE
394494001370,MINISTERIO DA JUSTICA E SEGURANCA PUBLICA,DF,NÃO CONTRIBUINTE
9597351000104,COMANDO DA 11A. REGIAO MILITAR,DF,NÃO CONTRIBUINTE
10825373000155,INSTITUTO FEDERAL DE ALAGOAS,AL,NÃO CONTRIBUINTE
10825373001399,IFAL - CAMPUS CORURIPE,AL,CONTRIBUINTE ISENTO
10825373000902,"INSTITUTO FEDERAL DE EDUCACAO, CIENCIA E TECNOLOGI",AL,NÃO CONTRIBUINTE
10825373000660,INSTITUTO FEDERAL DE ALAGOAS - CAMPUS PENEDO,AL,CONTRIBUINTE ISENTO
10825373000317,INSTITUTO FEDERAL DE ALAGOAS-MACEIO,AL,NÃO CONTRIBUINTE
396895001105,"MINISTERIO DA AGRICULTURA, PECUARIA E AB",DF,NÃO CONTRIBUINTE
4196645000100,IMPRENSA NACIONAL,DF,NÃO CONTRIBUINTE
10825373001550,INST. FED. DE ALAGOAS - CAMPUS RIO LARGO,AL,NÃO CONTRIBUINTE
10825373000236,"INSTITUTO FEDERAL DE EDUCACAO, CIENCIA E TECNOLOGI",AL,NÃO CONTRIBUINTE
10825373000589,INSTITUTO FEDERAL DE ALAGOAS - CAMPUS PALMEIRAS DOS INDIOS,AL,CONTRIBUINTE ISENTO
10825373000821,INST. FED. DE ALAGOAS/CAMPUS PIRANHAS,AL,CONTRIBUINTE ISENTO
10825373001127,INSTITUTO FED.DE EDUCA.CIENCIA E TEC.AL- IF/AL,AL,CONTRIBUINTE ISENTO
10825373000740,INSTITUTO FEDERAL DE ALAGOAS -CAMPUS SANTANA DO IPANEMA,AL,CONTRIBUINTE ISENTO
3659166001850,INSTITUTO BRASILEIRO DO MEIO AMBIENTE E DOS RECURSOS NATURAI,RN,NÃO CONTRIBUINTE
33787094001898,FUNDACAO INST BRAS DE GEO E ESTATISTICA,PB,NÃO CONTRIBUINTE
2360944000103,SUPERINTENDENCIA REGIONAL DO DISTRITO FEDERAL E ENTORNO - S,DF,CONTRIBUINTE ISENTO
394494002422,MINISTERIO DA JUSTICA E SEGURANCA PUBLICA,DF,NÃO CONTRIBUINTE
32901688000177,FUNDACAO CULTURAL PALMARES,DF,CONTRIBUINTE ISENTO
37115375000883,SERVICO FLORESTAL BRASILEIRO,DF,NÃO CONTRIBUINTE
7947821000189,AGENCIA NACIONAL DE AVIACAO CIVIL - ANAC,SP,NÃO CONTRIBUINTE
394494008382,MINISTERIO DA JUSTICA,DF,CONTRIBUINTE ISENTO
33787094003408,IBGE. E. / DF,DF,NÃO CONTRIBUINTE
3132745000100,COORDENACAO GERAL DE RECURSOS LOGISTICOS/ MCTI,DF,NÃO CONTRIBUINTE
26664015000148,"MINISTERIO TRANSPARENCIA, FISCAL. E  CONTROL. GERAL UNIAO",DF,NÃO CONTRIBUINTE
489828001046,"MINISTERIO DO PLANEJAMENTO, DESENVOLVIMENTO E GESTAO - MPDG",DF,NÃO CONTRIBUINTE
889834000108,FUND. COORD.DE APERFEICOAMENTO DE PESSOAL DE NIVEL SUP,DF,NÃO CONTRIBUINTE
26474056000171,INSTITUTO DO PATRIMONIO HISTORICO E ARTISTICO NACIONAL-IPHAN,DF,NÃO CONTRIBUINTE
42354068000119,SUSEP - SUPERINTENDENCIA DE SEGUROS PRIVADOS,RJ,NÃO CONTRIBUINTE
4903587000108,ANTAQ - AG. NAC. DE TRANS. AQUAVIARIOS BRASILIA,DF,NÃO CONTRIBUINTE
4898488000177,AGÊNCIA NACIONAL DE TRANSPORTES TERRESTRES,DF,CONTRIBUINTE ISENTO
627612000109,FUNDACAO ESCOLA NACIONAL DE ADMINISTRACAO PUBLICA,DF,CONTRIBUINTE ICMS
59311000126,FUNDACAO NACIONAL DO INDIO (FUNAI SEDE ),DF,CONTRIBUINTE ISENTO
394460001970,MINISTERIO DA ECONOMIA,PI,NÃO CONTRIBUINTE
10791831000344,INSTITUTO FEDERAL DE EDUCACAO CIENCIA E TECNOLOGIA,DF,CONTRIBUINTE ISENTO
26994558006830,ADVOCACIA GERAL DA UNIAO,DF,NÃO CONTRIBUINTE
3659166000102,INSTITUTO BRAS DO MEIO AMBIEN E DOS REC NAT RENOVAVEIS,DF,CONTRIBUINTE ISENTO
394460021653,PROCURADORIA GERAL DA FAZENDA NACIONAL,DF,CONTRIBUINTE ISENTO
9553484000251,HOSPITAL MILITAR DE AREA DE BRASILIA (HMAB),DF,NÃO CONTRIBUINTE
29979036061794,GERÊNCIA EXECUTIVA DO INSS DO DISTRITO FEDERAL,DF,CONTRIBUINTE ISENTO
10898596000142,INSTITUTO BRASILEIRO DE MUSEUS - IBRAM,DF,NÃO CONTRIBUINTE
27136980000887,MINISTERIO DA MULHER DA FAMILIA E DOS DIREITOS HUMANOS,DF,NÃO CONTRIBUINTE
35834377000120,UNIVERSIDADE FEDERAL DE CATALAO,GO,NÃO CONTRIBUINTE
9600725000195,1 REGIMENTO DE CAVALARIA DE GUARDA,DF,NÃO CONTRIBUINTE
10626896000415,"INSTITUTO FEDERAL DE EDUCACAO, CIENCIA E TECNOLOGIA DE MINAS",MG,NÃO CONTRIBUINTE
4892707000100,DNIT - DEPARTAMENTO NACIONAL DE INFRAEST DE TRANSPORTES,DF,CONTRIBUINTE ISENTO
394544018475,MINISTERIO DA SAUDE,MT,NÃO CONTRIBUINTE
1567601000143,UNIVERSIDADE FEDERAL DE GOIAS CEGEF,GO,NÃO CONTRIBUINTE
9580824000152,11 DEPOSITO DE SUPRIMENTO,DF,NÃO CONTRIBUINTE
394494000802,MINISTERIO DA JUSTICA E SEGURANCA PUBLICA,DF,CONTRIBUINTE ISENTO
37115375000298,MINISTERIO DO MEIO AMBIENTE,DF,NÃO CONTRIBUINTE
5457283000208,MINISTERIO DO TURISMO,DF,NÃO CONTRIBUINTE
14135659000160,BASE DE ADMINISTRACAO E APOIO DO CMP,DF,NÃO CONTRIBUINTE
9612844000168,2 BATALHAO DE INFANTARIA DE SELVA,PA,CONTRIBUINTE ISENTO
9613461000104,8O DEPOSITO DE SUPRIMENTO,PA,CONTRIBUINTE ISENTO
33663683002836,INSTITUTO DE DOENCAS DO TORAX,RJ,NÃO CONTRIBUINTE
394429019391,COMANDO DA AERONAUTICA (20529),PE,NÃO CONTRIBUINTE
394452025009,COMANDO DO EXERCITO,DF,NÃO CONTRIBUINTE
394429000615,BABR - BASE AEREA DE BRASILIA,DF,CONTRIBUINTE ISENTO
394429002669,COMANDO DA AERONAUTICA,MT,NÃO CONTRIBUINTE
1263896000598,"MINISTERIO DA CIENCIA, TECNOLOGIA, INOVACOES E COM",SP,NÃO CONTRIBUINTE
9590536000189,VIGESIMO QUINTO BATALHAO DE CACADORES,PI,NÃO CONTRIBUINTE
394429000968,BASE AEREA DE FLORIANOPOLIS,SC,CONTRIBUINTE ISENTO
4378626000197,FUNDACAO UNIVERSIDADE DO AMAZONAS,AM,NÃO CONTRIBUINTE
394429018905,COMANDO DA AERONAUTICA/GRUP.DE APOIO BOA VISTA,RR,CONTRIBUINTE ISENTO
33663683007129,CAMPUS UFRJ D CAXIAS PROF GERALDO CIDADE,RJ,NÃO CONTRIBUINTE
21040001000130,UNIVERSIDADE FEDERAL DE ITAJUBÁ,MG,NÃO CONTRIBUINTE
10764307001941,INSTITUTO FEDERAL DE EDUCACAO,BA,CONTRIBUINTE ISENTO
9573253000129,15 BATALHAO DE INFANTARIA MOTORIZADO,PB,NÃO CONTRIBUINTE
10723648000573,"INSTITUTO FEDERAL DE EDUCACAO, CIENCIA TEC DO SUDESTE DE MG",MG,CONTRIBUINTE ICMS
3277610000125,MINISTERIO DA DEFESA,DF,NÃO CONTRIBUINTE
33663683001783,UNIV FEDERAL DO RIO DE JANEIRO,RJ,NÃO CONTRIBUINTE
10882594002613,IFSP - MATAO,SP,NÃO CONTRIBUINTE
10562575000232,HOSPITAL GERAL DE SALVADOR,BA,NÃO CONTRIBUINTE
9565307000104,BASE ADMINISTRATIVA DA GUARNICAO DE NATA,RN,NÃO CONTRIBUINTE
29979036081396,INSTITUTO NACIONAL DO SEGURO SOCIAL,RS,NÃO CONTRIBUINTE
7517504000122,917 1 BATALHAO FERROVIARIO,SC,CONTRIBUINTE ISENTO
8829974001832,INST CHICO MENDES DE CONSERV DA BIODIVER,PA,NÃO CONTRIBUINTE
8829974000860,INST CHICO MENDES DE CONSERV DA BIODIVER,PE,NÃO CONTRIBUINTE
33663683004294,NUCLEO EM ECOLOGIA E DESENV. SOCIO-AMBIENTAL DE MACAE-NUPEM,RJ,NÃO CONTRIBUINTE
9644710000129,BASE ADMINISTRATIVA DA GUARNICAO DE FORTALEZA,CE,NÃO CONTRIBUINTE
8829974003100,INST CHICO MENDES DE CONSERV DA BIODIVER,MG,NÃO CONTRIBUINTE
10651417000410,"INSTITUTO FEDERAL DE EDUCACAO, CIENCIA E TECNOLOGIA GOIANO",GO,NÃO CONTRIBUINTE
10437535000188,CENTRO DE PREPARACAO DE OFICIAIS DA RESERVA DE SAO,SP,NÃO CONTRIBUINTE
394494007734,DPFFIG- MINISTERIO DA JUSTICA E SEGURANCA PUBLICA,PR,NÃO CONTRIBUINTE
25437484000242,UNIVERSIDADE FEDERAL DO TRIANGULO MINEIRO,MG,NÃO CONTRIBUINTE
394544020453,HOSPITAL FEDERAL DA LAGOA,RJ,NÃO CONTRIBUINTE
394429017933,GRUPAMENTO DOS AFONSOS - GAP/AF,RJ,NÃO CONTRIBUINTE
9552574000147,BASE DE ADMINISTRACAO E APOIO DO IBIRAPUERA,SP,NÃO CONTRIBUINTE
10648539000296,INSTITUTO FEDERAL DE EDUCACAO CIENCIA E TECNOLOGIA DO SUL DE,MG,CONTRIBUINTE ICMS
394544021263,INSTITUTO NACIONAL DE TRAUMATO-ORTOPEDIA,RJ,NÃO CONTRIBUINTE
394429006494,HOSPITAL DA AERONAUTICA DE RECIFE,PE,CONTRIBUINTE ISENTO
9577927000163,PREFEITURA MILITAR DE BRASILIA,DF,NÃO CONTRIBUINTE
33663683002674,INSTITUTO PUE. PED. MARTAGAO GESTEIRA UFRJ,RJ,NÃO CONTRIBUINTE
9552574000228,BASE DE ADMINISTRACAO E APOIO DO IBIRAPUERA - HTO/HTM,SP,NÃO CONTRIBUINTE
9570304000169,ARSENAL DE GUERRA DE SAO PAULO,SP,NÃO CONTRIBUINTE
9580391000135,20 GRUPO DE ARTILHARIA DE CAMPANHA LEVE,SP,NÃO CONTRIBUINTE
9655599000176,COMANDO DE FRONTEIRA - ACRE/4º BIS,AC,CONTRIBUINTE ISENTO
394544021000,MINISTERIO DA SAUDE,RJ,NÃO CONTRIBUINTE
9559385000104,COMANDO 11 BRIGADA DE INFANTARIA LEVE,SP,NÃO CONTRIBUINTE
29406625002345,ANM- AGENCIA NACIONAL DE MINERACAO,PA,CONTRIBUINTE ISENTO
62428073000136,"FUNDACAO JORGE DUPRAT FIGUEIREDO, DE SEGURANCA E MEDICINA DO",SP,CONTRIBUINTE ICMS
394452053487,DEPARTAMENTO DE CIENCIA E TECNOLOGIA DO EXERCITO BRASILEIRO,DF,CONTRIBUINTE ISENTO
394536000643,MINISTERIO DAS RELACOES EXTERIORES,DF,NÃO CONTRIBUINTE
9575593000199,TERCEIRO CENTRO DE TELEMATICA DE AREA,SP,NÃO CONTRIBUINTE
10495077000214,COMANDO DA SEXTA REGIAO MILITAR,BA,NÃO CONTRIBUINTE
10363252000139,SEXTO BATALHAO DE POLICIA DO EXERCITO,BA,CONTRIBUINTE ISENTO
10527574000176,DECIMO NONO BATALHAO DE CACADORES,BA,CONTRIBUINTE ISENTO
10339838000168,ESCOLA DE FORMACAO COMPLEMENTAR DO EXERCITO,BA,CONTRIBUINTE ISENTO
394494014510,PENITENCIARIA FEDERAL EM CATANDUVAS,PR,NÃO CONTRIBUINTE
9572327000102,22 BATALHÃO LOGISTICO LEVE,SP,NÃO CONTRIBUINTE
10313835000155,22 DEPOSITO DE SUPRIMENTO,SP,NÃO CONTRIBUINTE
10662072001120,INSTITUTO FED DE EDUC CIENCIA E TECNOL FARROUPILHA,RS,CONTRIBUINTE ISENTO
10266175000280,LABORATORIO QUIMICO FARMACEUTICO DO EXERCITO,RJ,NÃO CONTRIBUINTE
9584037000189,19º GRUPO DE ARTILHARIA DE CAMPANHA,RS,CONTRIBUINTE ISENTO
33781055001026,INSTITUTO NACIONAL DE INFECTOLOGIA EVANDRO CHAGAS,RJ,NÃO CONTRIBUINTE
9591691000110,POLICLINICA MILITAR DO RIO DE JANEIRO,RJ,CONTRIBUINTE ISENTO
9577927000244,PREFEITURA MILITAR DE BRASILIA,DF,NÃO CONTRIBUINTE
83899526000182,UNIVERSIDADE FED DE SANTA CATARINA,SC,CONTRIBUINTE ISENTO
9559304000168,BASE DE ADM E APOIO DO CMDO MILITAR DO OESTE,MS,NÃO CONTRIBUINTE
394429019120,COMANDO DA AERONAUTICA,MS,NÃO CONTRIBUINTE
10635424000500,INSTITUTO FEDERAL DE EDUCACAO CIENCIA E TECNOLOGIA CATARINEN,SC,NÃO CONTRIBUINTE
9563296000123,13 GRUPO DE ARTILHARIA DE CAMPANHA,RS,CONTRIBUINTE ISENTO
394429018581,BASE AEREA DE NATAL,RN,NÃO CONTRIBUINTE
394460015254,MINISTERIO DA FAZENDA - ALFANDEGA DA RFB DO PORTO DO RIO GRA,RS,CONTRIBUINTE ISENTO
394429001425,COMANDO DA AERONAUTICA 0002089,BA,CONTRIBUINTE ISENTO
