codigo,nome,uf,indicador
33892175000100,INSTITUTO DE PESQUISA ECONOMICA APLICADA,DF,CONTRIBUINTE ISENTO
38166000288,BANCO CENTRAL DO BRASIL,PA,NÃO CONTRIBUINTE
9645528000273,14 BATALHAO DE INFANTARIA MOTORIZADO,PE,CONTRIBUINTE ISENTO
9586924000196,DEPOSITO CENTRAL DE MUNICAO,RJ,NÃO CONTRIBUINTE
10784782000401,INSTITUTO FEDERAL DE MATO GROSSO,MT,NÃO CONTRIBUINTE
10695891001092,"INSTITUTO FED DE EDUCACAO, CIENCIA E TECNOLOGIA DO TRIANGULO",MG,NÃO CONTRIBUINTE
10784782000908,"INSTITUTO FEDERAL DE EDUCACAO, CIENCIA E TECNOLOGIA DE MATO",MT,NÃO CONTRIBUINTE
60453032000417,UNIVERSIDADE FEDERAL DE SAO PAULO - UNIFESP BAIXADA SANTISTA,SP,NÃO CONTRIBUINTE
10652179000972,INSTITUTO FEDERAL DE EDUCACAO CIENCIAE TECNOLOGIA DO PARANA,PR,NÃO CONTRIBUINTE
33781055001964,FUNDACAO OSWALDO CRUZ,RJ,CONTRIBUINTE ISENTO
10735145001751,INSTITUTO FEDERAL DE EDUCACAO CIENCIAE TECNOLOGIA DO MARANHA,MA,NÃO CONTRIBUINTE
7775847000278,HOSPITAL UNIVERSITARIO DA UFGD,MS,NÃO CONTRIBUINTE
17217985002310,FACULDADE DE FARMACIA UFMG,MG,NÃO CONTRIBUINTE
10652179001278,"INSTITUTO FEDERAL DE EDUCACAO, CIENCIA E TECNOLOGIA DO PARAN",PR,NÃO CONTRIBUINTE
10877412000591,INSTITUTO FEDERAL DE EDUCACAO CIENCIAE TECNOLOGIA DO RIO GRA,RN,NÃO CONTRIBUINTE
394460001709,MINISTERIO DA ECONOMIA,PB,NÃO CONTRIBUINTE
11402887000837,"INSTITUTO FEDERAL DE EDUCACAO, CIENCIA E TECNOLOGIA DE SANTA",SC,CONTRIBUINTE ISENTO
10764307000384,"INSTITUTO FEDERAL DE EDUCACAO DA BAHIA, CIENCIA E TECNOLOGIA",BA,CONTRIBUINTE ISENTO
42414284000293,COLEGIO PEDRO II,RJ,CONTRIBUINTE ISENTO
402552001440,CENTRO REGIONAL DE CIÊNCIAS NUCLEARES DO NORDESTE,PE,CONTRIBUINTE ICMS
10635424000429,INSTITUTO FEDERAL DE ED CIENCIA E TEC CATARINENSE,SC,CONTRIBUINTE ISENTO
9579618000203,PRIMEIRO BATALHAO DE COMUNICACOES,RS,NÃO CONTRIBUINTE
9580957000129,1 REGIMENTO DE CAVALARIA MECANIZADO,RS,CONTRIBUINTE ISENTO
7521315000123,DEPARTAMENTO DE ENGENHARIA E CONSTRUCAO - DEC,DF,CONTRIBUINTE ISENTO
9536757000250,COMANDO DA 17 BRIGADA DE INFANTARIA DE SELVA,RO,NÃO CONTRIBUINTE
9634813000108,23 BATALHAO DE INFANTARIA,SC,NÃO CONTRIBUINTE
9651689000270,1 REGIMENTO DE CARROS DE COMBATE,RS,NÃO CONTRIBUINTE
394502003593,COMANDO DA MARINHA,CE,NÃO CONTRIBUINTE
10764307000465,"INSTITUTO FEDERAL DE EDUCACAO, CIENCIA E TECNOLOGIA DA BAHIA",BA,NÃO CONTRIBUINTE
10302912000171,11 GRUPO DE ARTILHARIA ANTIAEREA,DF,NÃO CONTRIBUINTE
23396663000172,BASE DE ADMINISTRACAO E APOIO/CMN,PA,NÃO CONTRIBUINTE
10189168000140,COMANDO DA 1A REGIAO MILITAR,RJ,NÃO CONTRIBUINTE
394452054459,4 GRUPO DE ARTILHARIA ANTIAEREA,MG,NÃO CONTRIBUINTE
17217985000961,UNIVERSIDADE FEDERAL DE MINAS GERAIS,MG,NÃO CONTRIBUINTE
38166001098,BANCO CENTRAL DO BRASIL,RJ,NÃO CONTRIBUINTE
10898596000223,INSTITUTO BRASILEIRO DE MUSEUS IBRAM,SP,CONTRIBUINTE ISENTO
10898596001467,INSTITUTO BRASILEIRO DE MUSEUS - IBRAM,SC,NÃO CONTRIBUINTE
10898596002196,INSTITUTO BRASILEIRO DE MUSEUS-MUSEU NACIONAL DE BELAS ARTES,RJ,NÃO CONTRIBUINTE
10898596000495,INSTITUTO BRASILEIRO DE MUSEUS - IBRAM,RS,NÃO CONTRIBUINTE
10724903001221,INSTITUTO FEDERAL DE EDUCACAO CIENCIA E TECNOLOGIA BAIANO,BA,NÃO CONTRIBUINTE
9560963000203,COMANDO 10 REGIÃO MILITAR,CE,NÃO CONTRIBUINTE
10728444001173,"INSTITUTO FEDERAL DE EDUCACAO, CIENCIA E TECNOLOGIA DE SERGI",SE,NÃO CONTRIBUINTE
10637926000650,INSTITUTO FED. DO RS/CAMPUS CANOAS,RS,NÃO CONTRIBUINTE
10839508000212,INSTITUTO FEDERAL DE RORAIMA - CAMPUS BOA VISTA,RR,NÃO CONTRIBUINTE
37294496000163,CENTRO DE LOGISTICA DE MISSEIS E FOGUETES,GO,NÃO CONTRIBUINTE
9549370000238,9O GRUPAMENTO LOGISTICO,MS,NÃO CONTRIBUINTE
32479149000191,RESTAURANTE CENTRAL DA UFES,ES,CONTRIBUINTE ISENTO
9544774000239,POLICLINICA MILITAR DE PORTO ALEGRE,RS,NÃO CONTRIBUINTE
9616119000168,HOSPITAL GERAL DO RIO DE JANEIRO,RJ,CONTRIBUINTE ISENTO
10724903000250,INSTITUTO FEDERAL DE EDUCAÇÃO CIENCIA E TECNOLOGIA BAIANO,BA,NÃO CONTRIBUINTE
37088373000257,BASE ADMINISTRATIVA DO COMPLEXO DE SAUDE DO RJ,RJ,NÃO CONTRIBUINTE
7540208000142,QUARTO BATALHAO DE ENGENHARIA DE CONSTRUCAO,BA,NÃO CONTRIBUINTE
75101873000947,UNIVERSIDADE TECNOLOGICA FEDERAL DO PARA,PR,NÃO CONTRIBUINTE
75101873000513,UTFPR CAMPUS PONTA GROSSA,PR,NÃO CONTRIBUINTE
10735145002995,INST.FED.DO MARANHAO/CAMPUS ITAPECURU MIRIM,MA,CONTRIBUINTE ISENTO
34621748000638,UNIVERSIDADE FEDERAL DO PARA - EDITORA UFPA,PA,CONTRIBUINTE ICMS
9578149000127,COMISSAO REGIONAL DE OBRAS DA 2A REGIAO MILITAR,SP,NÃO CONTRIBUINTE
34143842000114,FUNDAÇÃO OSÓRIO,RJ,NÃO CONTRIBUINTE
10877412000834,"INSTITUTO FEDERAL DE EDUCACAO, CIENCIA E TECNOLOGIA DO RIO G",RN,NÃO CONTRIBUINTE
4418943000190,FUNDACAO UNIVERSIDADE FEDERAL DE RONDONIA,RO,CONTRIBUINTE ISENTO
10817343000440,INSTITUTO FEDERAL DE RONDONIA,RO,CONTRIBUINTE ISENTO
9564970000275,13 BATALHAO DE INFANTARIA BLINDADO,PR,CONTRIBUINTE ISENTO
33787094001200,FUNDAÇÃO INSTITUTO BRASILE DE GEOGRAFIA E ESTATÍSTICA IBGE,ES,NÃO CONTRIBUINTE
396895003655,"MINISTERIO DA AGRICULTURA, PECUARIA E ABASTECIMENTO",RO,NÃO CONTRIBUINTE
10652179000620,"INSTITUTO FEDERAL DE EDUCACAO, CIENCIA E TECNOLOGIA DO PARAN",PR,NÃO CONTRIBUINTE
394544018203,SUP. EST. DO MINISTERIO DA SAUDE EM GOIAS,GO,NÃO CONTRIBUINTE
5440725000203,HOSP ENS DR WASHINGTON A BARRO,PE,NÃO CONTRIBUINTE
9571694000191,COMANDO  14 BRIGADA  INFANTARIA MOTORIZADA,SC,CONTRIBUINTE ISENTO
9586988000197,63 BATALHAO DE INFANTARIA,SC,CONTRIBUINTE ISENTO
34621748000476,UNIVERSIDADE FEDERAL DO PARA,PA,NÃO CONTRIBUINTE
33663683004456,DECANATO DO CENT DE FILOSOF. E C HUM DA UFRJ,RJ,CONTRIBUINTE ISENTO
9609161000151,PARQUE REGIONAL DE MANUTENCAO/8,PA,NÃO CONTRIBUINTE
3659166001346,INST BRAS DO MEIO AMB E REC NAT RENOVAVEIS IBAM,MT,NÃO CONTRIBUINTE
9559239000251,26 GRUPO DE ARTILHARIA DE CAMPANHA,PR,CONTRIBUINTE ISENTO
33787094003165,DIVISAO DE PESQ IBGE/RO,RO,CONTRIBUINTE ISENTO
33787094002940,INSTIT BRAS DE GEOGRAFIA E ESTATISTICA IBGE,SE,NÃO CONTRIBUINTE
33663683004880,DECANATO DO CENTRO DE C JUR E ECONOM. DA UFRJ,RJ,CONTRIBUINTE ISENTO
10652179000204,"INSTITUTO FEDERAL DE EDUCACAO,CIENCIA E TECNOLOGIA DO PARANA",PR,NÃO CONTRIBUINTE
10728444000878,INSTITUTO FED. DE SERGIPE - CAMPUS PROPRIÁ,SE,NÃO CONTRIBUINTE
11402887002104,IFSC - CAMPUS GAROPABA,SC,CONTRIBUINTE ISENTO
9560096000206,62 BATALHAO DE INFANTARIA,SC,NÃO CONTRIBUINTE
26474056000503,INSTITUTO DO PATRIM HISTORICO E ARTISTICO NACIONAL,CE,NÃO CONTRIBUINTE
10870883001469,"INSTITUTO FEDERAL DE EDUCACAO, CIENCIA E",GO,NÃO CONTRIBUINTE
9579771000150,28 GRUPO DE ARTILHARIA DE CAMPANHA,SC,CONTRIBUINTE ISENTO
394544004849,DISTRITO SANITARIO ESPECIAL INDIGENA ALTAMIRA,PA,NÃO CONTRIBUINTE
10877412001130,INSTITUTO FEDERAL DE EDUCACAO CIENCIAE TECNOLOGIA DO RIO GRA,RN,NÃO CONTRIBUINTE
394460013391,ALFANDEGA DO AEROPORTO INT. VIRACOPOS,SP,NÃO CONTRIBUINTE
10763998000563,"INSTITUTO FEDERAL DE EDUCACAO, CIENCIA E TECNOLOGIA DO PARA",PA,NÃO CONTRIBUINTE
10729992000499,"INST FEDERAL DE EDUCAÇÃO, CIENCIA E TECNOLOGIA SUL RG RS",RS,NÃO CONTRIBUINTE
9579771000230,28 GRUPO DE ARTILHARIA DE CAMPANHA - SC,SC,NÃO CONTRIBUINTE
17217985001267,ESCOLA DE EDUCAÇÃO FÍSICA FISIOT. TERAP. OCUP/UFMG,MG,CONTRIBUINTE ISENTO
9545610000145,12 COMPANHIA DECOMUNICACAO MECANIZADA (4439),RS,NÃO CONTRIBUINTE
394494008030,MINISTERIO DA JUSTICA,DF,NÃO CONTRIBUINTE
9563085000190,PRIMEIRO CENTRO DE GEOINFORMA&CCEDIL;&ATILDE;O,RS,CONTRIBUINTE ISENTO
35872812000101,UNIVERSIDADE FEDERAL DO AGRESTE DE PERNAMBUCO - UFAPE,PE,NÃO CONTRIBUINTE
33663683001511,UNIVERSIDADE FEDERAL DO RIO DE JANEIRO,RJ,NÃO CONTRIBUINTE
9602705000153,14º GRUPO DE ARTILHARIA DE CAMPANHA,MG,CONTRIBUINTE ISENTO
10898596003249,INSTITUTO BRASILEIRO DE MUSEUS - IB,ES,NÃO CONTRIBUINTE
10898596001114,INSTITUTO BRASILEIRO DE MUSEUS IBRA MUSEU REGIONAL DE SAO JO,MG,NÃO CONTRIBUINTE
10898596001386,MUSEU DA ABOLICAO,PE,CONTRIBUINTE ISENTO
10898596001890,INSTITUTO BRASILEIRO DE MUSEUS - IB,MG,NÃO CONTRIBUINTE
10870883000730,"INSTITUTO FEDERAL DE EDUCAÇÃO, CIÊNCIA E TECNOLOGIA DE GOIÁS",GO,NÃO CONTRIBUINTE
9594477000206,5 BATALHAO DE INFANTARIA LEVE - 5 BIL,SP,NÃO CONTRIBUINTE
394460014959,DELEGACIA DA RECEITA FEDERAL DE PELOTAS,RS,NÃO CONTRIBUINTE
394429000453,BASE AEREA DOS AFONSOS - C38,RJ,CONTRIBUINTE ISENTO
10763998001888,INSTITUTO FEDERAL DO PARA CAMPUS ANANINDEUA,PA,NÃO CONTRIBUINTE
394460007073,SUPERINTENDENCIA REGIONAL RFB 2A REGIAO FISCAL - BELEM,PA,NÃO CONTRIBUINTE
38174001972,RETIRADA NA LIVRARIA CENTRO DE VIVENCIA,DF,CONTRIBUINTE ICMS
396895002098,MINISTERIO DA AGRICULTURA PECUARIA E ABASTECIMENTO,PB,NÃO CONTRIBUINTE
59311005276,FUNAI/COORDENAÇÃO REGIONAL DE GUAJARA-MIRIM / RONDÔNIA,RO,CONTRIBUINTE ISENTO
24365710000345,CENTRO DE BIOCIENCIAS DA UFRN,RN,NÃO CONTRIBUINTE
29979036021490,INSTITUTO NACIONAL DO SEGURO SOCIAL,PI,NÃO CONTRIBUINTE
29979036007404,INSTITUTO NACIONAL DO SEGURO SOCIAL,MA,NÃO CONTRIBUINTE
10830301000872,IF SERTAO PE CAMPUS SERRA TALHADA,PE,NÃO CONTRIBUINTE
4892707001859,DNIT DEPARTAMENTO NACIONAL DE INFRAEST DE TRANSPOR,AL,NÃO CONTRIBUINTE
10817343000520,[168046] IFRO - CAMPUS DE ARIQUEMES,RO,NÃO CONTRIBUINTE
10817343000369,"INST. FED. DE EDUC.,CIENCIA E TECNOLOGIA DE RONDONIA",RO,NÃO CONTRIBUINTE
10817343000601,IFE CIENCIA E TECNOLOGIA DE RONDONIA,RO,NÃO CONTRIBUINTE
10626896001659,INSTITUTO FEDERAL DE MINAS GERAIS - CAMPUS ARCOS,MG,NÃO CONTRIBUINTE
17217985001429,ESCOLA DE VETERINARIA DA UFMG,MG,NÃO CONTRIBUINTE
1263896002612,"MINISTERIO DA CIENCIA, TECNOLOGIA, INOVACOES E COMUNICACOES",SP,CONTRIBUINTE ISENTO
9566422000101,BASE DE APOIO REGIONAL DE SOROCABA,SP,NÃO CONTRIBUINTE
10952708001097,"INSTITUTO FEDERAL DE EDUCACAO, CIENCIA E TECNOLOGIA DO RIO D",RJ,NÃO CONTRIBUINTE
42414284000536,COLEGIO PEDRO II,RJ,NÃO CONTRIBUINTE
9640404000114,PREFEITURA MILITAR DA ZONA SUL,RJ,NÃO CONTRIBUINTE
33663683005002,UNIVERSIDADE FEDERAL DO RIO DE JANEIRO,RJ,NÃO CONTRIBUINTE
59311007139,FUNDACAO NACIONAL DO INDIO,SP,NÃO CONTRIBUINTE
10744098002946,IFCE/ CAMPUS PARACURU,CE,NÃO CONTRIBUINTE
10763998001292,"INSTITUTO FEDERAL DE EDUCACAO,CIENCIA E TECNOLOGIA DO PARA",PA,NÃO CONTRIBUINTE
10635424001310,INSTITUTO FEDERAL DE EDUCACAO CIENCIA E,SC,NÃO CONTRIBUINTE
10744098000650,"INST.FED.DE EDUCACAO CIENCIA, TECNOLOGIA -IFCE CAMPUS SOBRAL",CE,CONTRIBUINTE ISENTO
9538279000136,58 BATALHAO DE INFANTARIA MOTORIZADO - 12145,GO,NÃO CONTRIBUINTE
10817343000792,"INSTITUTO FEDERAL DE EDUCACAO,CIENCIA E TECNOLOGIA",RO,CONTRIBUINTE ISENTO
396895009424,SERVIÇO FLORESTAL BRASILEIRO,DF,NÃO CONTRIBUINTE
396895007561,MINISTERIO DA AGRICULTURA PECUARIA E ABASTECIMENTO (3076133),DF,NÃO CONTRIBUINTE
5055128000338,CENTRO DE FORMACAO DE PROFESSORES DA UFCG,PB,CONTRIBUINTE ISENTO
9543440000160,14 REGIMENTO DE CAVALARIA MECANIZADO,SC,NÃO CONTRIBUINTE
42519488000108,FUNDACAO CASA DE RUI BARBOSA,RJ,CONTRIBUINTE ISENTO
10727655001191,"INSTITUTO FEDERAL DE EDUCACAO, CIENCIA E TECNOLOGIA DO NORTE",MG,CONTRIBUINTE ICMS
10877412001997,"INSTITUTO FEDERAL DE EDUCACAO, CIENCIA E TECNOLOGIA DO RIO G",RN,NÃO CONTRIBUINTE
394429018743,COMANDO DA AERONAUTICA,PR,CONTRIBUINTE ISENTO
9552692000155,COMANDO DA QUINTA REGIAO MILITAR QUINTA DIVISAO DE EXERCITO,PR,NÃO CONTRIBUINTE
33787094001545,FUNDACAO INSTIT BRAS DE GEOGRAFIA E,MT,NÃO CONTRIBUINTE
10838653001927,INSTITUTO FEDERAL DO ESPIRITO SANTO - CAMPUS PIUMA,ES,NÃO CONTRIBUINTE
8829974001751,INSTITUTO CHICO MENDES DE CONSERVACAO DA BIODIVERSIDADE,RS,NÃO CONTRIBUINTE
9653170000140,COMANDO DA 15 BRIGADA DE INFANTARIA MECANIZADA,PR,CONTRIBUINTE ISENTO
9541775000149,15: BATALHAO LOGISTICO,PR,NÃO CONTRIBUINTE
3659166002741,IBAMA - SUPERINTENDENCIA DA BAHIA/BA,BA,NÃO CONTRIBUINTE
5055128000842,CENTRO DE DESENVOLVIMENTO SUSTENTAVEL DO SEMIARIDO-UFCG,PB,NÃO CONTRIBUINTE
9606820000287,COMANDO MILITAR DO SUL,RS,NÃO CONTRIBUINTE
10729992001380,"INSTITUTO FEDERAL DE EDUCACAO, CIENCIA E TECNOLOGIA SUL-RIO",RS,CONTRIBUINTE ISENTO
375972000756,INSTITUTO NACIONAL DE COLONIZACAO E REFORMA AGRARIA,BA,NÃO CONTRIBUINTE
10877412001059,INSTITUTO FED DE ED CE TEC DO RN,RN,NÃO CONTRIBUINTE
9650564000144,19 REGIMENTO CAVALARIA MECANIZADO.,RS,NÃO CONTRIBUINTE
33787094000816,FUNDACAO INSTIT BRAS DE GEOGRAFIA E ESTA,CE,NÃO CONTRIBUINTE
394429005331,ESCOLA DE ESPECIALISTAS DE AERONAUTICA,SP,NÃO CONTRIBUINTE
10838653000521,"INSTITUTO FEDERAL DE EDUCAÇÃO, CIÊNCIA E TECNOLOGIA DO ESPÍR",ES,NÃO CONTRIBUINTE
9646901000120,15 REGIMENTO DE CAVALARIA MECANIZADO (ESCOLA),RJ,CONTRIBUINTE ISENTO
10882594003180,"INSTITUTO FEDERAL DE EDUCACAO,CIENCIA E TECNOLOGIA DE SAO PA",SP,CONTRIBUINTE ISENTO
10724903000764,"INSTITUTO FEDERAL DE EDUCACAO, CIEN TECNOLOGIA BAIANO",BA,NÃO CONTRIBUINTE
9605603000272,SEGUNDO BATALHAO DE INFANTARIA LEVE,SP,NÃO CONTRIBUINTE
24134488000965,UNIVERSIDADE FEDERAL DE PERNAMBUCO,PE,NÃO CONTRIBUINTE
17217985000880,153285 - FACULDADE DE EDUCACAO/UFMG,MG,CONTRIBUINTE ISENTO
59311002684,FUNDACAO NACIONAL DO INDIO - FUNAI,PA,NÃO CONTRIBUINTE
394460047962,DELEGACIA DA RECEITA FEDERAL EM LIMEIRA,SP,NÃO CONTRIBUINTE
10806496001382,INSTITUTO FEDERAL DO PIAUI CAMPOS SJP,PI,NÃO CONTRIBUINTE
4903587000876,AGENCIA NACIONAL DE TRANSPORTES AQUAVIARIOS,RO,NÃO CONTRIBUINTE
9660364000172,BATALHAO ESCOLA DE COMUNICACOES,RJ,CONTRIBUINTE ISENTO
4892707001182,DNITDEPARTAMENTO NACIONAL DE INFRAEST DE TRANSPORTES,PA,NÃO CONTRIBUINTE
10838653000955,INST. FED. ESPIRITO SANTO/ CAMPUS SÃO MATEUS,ES,NÃO CONTRIBUINTE
9625886000133,9 GRUPO DE ARTILHARIA DE CAMPANHA (NIOAQUE),MS,NÃO CONTRIBUINTE
4892707001344,DNIT-DEPARTAMENTO NACIONAL DE INFRAEST DE TRANSPORTES,PI,CONTRIBUINTE ISENTO
9586056000144,2A COMPANHIA DE FRONTEIRA,MS,NÃO CONTRIBUINTE
9545602000107,17A BASE LOGISTICA,RO,NÃO CONTRIBUINTE
9590085000260,7 BATALHAO DE ENGENHARIA DE COMBATE,RN,NÃO CONTRIBUINTE
394429006907,PARQUE DE MATERIAL DE ELETRONICA DA AERONAUTICA,RJ,NÃO CONTRIBUINTE
11803735000170,3º BATALHÃO DE INFANTARIA DE SELVA,AM,NÃO CONTRIBUINTE
394460022978,MINISTERIO DA FAZENDA,AL,NÃO CONTRIBUINTE
394460023001,MINISTERIO DA FAZENDA,AM,NÃO CONTRIBUINTE
394460051641,MINISTERIO DA FAZENDA,BA,NÃO CONTRIBUINTE
9556290000129,27º GRUPO DE ARTILHARIA DE CAMPANHA,RS,CONTRIBUINTE ISENTO
10635424000690,INST FED CATARINENSECAMPUS SANTA ROSA DO SUL,SC,NÃO CONTRIBUINTE
8829974001409,INST CHICO MENDES DE CONSERV DA BIODIVER,GO,NÃO CONTRIBUINTE
10767239001621,"INSTITUTO FEDERAL DE EDUCACAO, CIENCIA E TECNOLOGIA DE PERNA",PE,CONTRIBUINTE ISENTO
4892707001263,DNIT-DEPARTAMENTO NACIONAL DE INFRAEST DE TRANSPORTES,PB,NÃO CONTRIBUINTE
7947821000340,AGENCIA NACIONAL DE AVIACAO CIVIL ANAC,PE,NÃO CONTRIBUINTE
29979036015504,INSTITUTO NACIONAL DO SEGURO SOCIAL INSS,PA,NÃO CONTRIBUINTE
29979036068020,INSTITUTO NACIONAL DO SEGURO SOCIAL,AP,NÃO CONTRIBUINTE
29979036008397,GERENCIA EXECUTIVA CUIABA,MT,CONTRIBUINTE ISENTO
33663683005509,INSTITUTO ALBERTO LUIZ COIMBRA DE POS GRADUACAO COPPE,RJ,CONTRIBUINTE ISENTO
9552435000113,HOSPITAL DE GUARNICAO DE PORTO VELHO,RO,NÃO CONTRIBUINTE
9647168000168,5 BATALHAO LOGISTICO,PR,NÃO CONTRIBUINTE
29507878000108,COMISSAO DE VALORES MOBILIARIOS,RJ,CONTRIBUINTE ISENTO
394544004253,MINISTERIO DA SAUDE,AL,NÃO CONTRIBUINTE
394429019200,COMANDO DA AERONAUTICA,RO,NÃO CONTRIBUINTE
394460012158,MINISTERIO DA FAZENDA,SP,NÃO CONTRIBUINTE
10877412000320,"INSTITUTO FEDERAL DE EDUCACAO, CIENCIA E TECNOLOGIA DO RIO G",RN,NÃO CONTRIBUINTE
17217985004525,PRO REITORIA DE POS GRADUACAO - UFMG,MG,CONTRIBUINTE ISENTO
33787094001383,FUNDACAO INSTIT BRAS DE GEOGRAFIA E ESTATISTICA IBGE,GO,NÃO CONTRIBUINTE
489828003170,MECON - SPU -SP,SP,CONTRIBUINTE ISENTO
59311005004,FUNDACAO NACIONAL DO INDIO,MS,NÃO CONTRIBUINTE
10952708000600,"INSTITUTO FEDERAL DE EDUCACAO, CIENCIA E TECNOLOGIA DO RIO D",RJ,CONTRIBUINTE ISENTO
10767239000226,IFPE - CAMPUS IPOJUCA,PE,CONTRIBUINTE ISENTO
24134488000884,19918 - SUPERINTENDENCIA DE COMUNICACAO DA UFPE,PE,NÃO CONTRIBUINTE
9613799000166,10 REGIMENTO DE CAVALARIA MECANIZADO,MS,NÃO CONTRIBUINTE
3659166001931,INSTITUTO BRASILEIRO DO MEIO AMBIENTE E DOS RECURS,RO,NÃO CONTRIBUINTE
37088373000176,BASE ADMINISTRATIVA DO COMPLEXO DE SAUDE DO RIO DE JANEIRO R,RJ,NÃO CONTRIBUINTE
394460023605,PROCURADORIA DA FAZENDA NACIONAL DO ESTADO DO PARA,PA,NÃO CONTRIBUINTE
489828002360,MINISTERIO DO PLANEJAMENTO ORCAMENTO E GESTAO MP,BA,NÃO CONTRIBUINTE
59311004709,FUNDACAO NACIONAL DO INDIO,PB,NÃO CONTRIBUINTE
33663683000388,UNIVERSIDADE FEDERAL DO RIO DE JANEIRO - HESFA,RJ,NÃO CONTRIBUINTE
10792928001262,IFAM - CAMPUS HUMAITA,AM,NÃO CONTRIBUINTE
394494014358,PENITENCIARIA FEDERAL EM MOSSORO - RN,RN,NÃO CONTRIBUINTE
7526983003088,FUNDO DE AMPARO AO TRABALHADOR,PR,CONTRIBUINTE ISENTO
10744098001893,INST.FED.EDUC.CIENC.TECNOL.CE.IFCE JAGUARIBE,CE,NÃO CONTRIBUINTE
24134488001503,UNIVERSIDADE FEDERAL DE PERNAMBUCO,PE,NÃO CONTRIBUINTE
9600122000274,COMANDO DO COMANDO MILITAR DO NORDESTE,PE,NÃO CONTRIBUINTE
394460023354,MINISTERIO DA FAZENDA,MA,NÃO CONTRIBUINTE
394460051722,PROCURADORIA SECCIONAL DA FAZENDA NAC. EM SANTAREM,PA,CONTRIBUINTE ISENTO
394460022382,MINISTERIO DA FAZENDA,CE,NÃO CONTRIBUINTE
394460022200,MINISTERIO DA FAZENDA,BA,NÃO CONTRIBUINTE
394460041689,MINISTERIO DA FAZENDA,RR,NÃO CONTRIBUINTE
9575090000202,23 BATALHAO DE CACADORES,CE,CONTRIBUINTE ISENTO
10784782001041,INSTIT.FED. DE EDUC. CIENCIA E TECNOLOGIA DE MT-CAMPUS JUINA,MT,NÃO CONTRIBUINTE
9648887000101,SETIMO GRUPO DE ARTILHARIA DE CAMPANHA,PE,NÃO CONTRIBUINTE
10742006000279,INSTITUTO FEDERAL DE EDUCACAO CIENCIA E TECNOLOGIA DO,TO,CONTRIBUINTE ICMS
396895003060,MINISTERIO DA AGRICULTURA PECUARIA E ABASTECIMENTO,SC,CONTRIBUINTE ISENTO
9559505000246,10 BATALHAO LOGISTICO,RS,CONTRIBUINTE ISENTO
10898596002510,MUSEU VILLA LOBOS - MVL,RJ,NÃO CONTRIBUINTE
10898596002358,INSTITUTO BRASILEIRO DE MUSEUS,RJ,CONTRIBUINTE ISENTO
394544020020,MINISTERIO DA SAUDE,TO,NÃO CONTRIBUINTE
10226490000100,PRIMEIRO BATALHAO DE POLICIA DO EXERCITO,RJ,NÃO CONTRIBUINTE
394452005598,35º BATALHAO DE INFANTARIA,BA,NÃO CONTRIBUINTE
9575593000270,3 CENTRO DE TELEMATICA DE AREA,SP,CONTRIBUINTE ISENTO
9582350000269,PARQUE REGIONAL DE MANUTENCAO3,RS,NÃO CONTRIBUINTE
10952708000368,INST.FED.DO RJ/CAMPUS VOLTA REDOND,RJ,CONTRIBUINTE ISENTO
18621825000199,UNIVERSIDADE FEDERAL DO CARIRI-UFCA,CE,CONTRIBUINTE ISENTO
394460012662,DELEGACIA DA RECEITA FEDERAL DO BRASIL EM RIB.PRETO,SP,NÃO CONTRIBUINTE
10724903000330,"INSTITUTO FEDERAL DE EDUCACAO, CIENCIA E TECNOLOGIA BAIANO",BA,NÃO CONTRIBUINTE
394460000494,GERENCIA REGIONAL DE ADM.DO MF/AL,AL,NÃO CONTRIBUINTE
8829974002308,INST CHICO MENDES DE CONSERV DA BIODIVER,TO,NÃO CONTRIBUINTE
10637926000308,INST FED DO RSCAMPUS PORTO ALEGRE,RS,CONTRIBUINTE ISENTO
9602705000234,14 GRUPO DE ARTILHARIA DE CAMPANHA,MG,NÃO CONTRIBUINTE
15180714000368,UFBA - MATERNIDADE CLIMERIO DE OLIVEIRA,BA,NÃO CONTRIBUINTE
394544017827,MINISTERIO DA SAUDE - SUPERINTENDENCIA ESTADUAL DO MS/AP,AP,CONTRIBUINTE ISENTO
394452032722,4 DEPOSITO DE SUPRIMENTO,MG,NÃO CONTRIBUINTE
3510668000258,COLEGIO MILITAR DE JUIZ DE FORA,MG,NÃO CONTRIBUINTE
10729992000901,INSTITUTO FEDERAL SUL-RIO-GRANDENSE - IFSUL CAMPUS VENANCIO,RS,CONTRIBUINTE ISENTO
8829974000780,INSTITUTO CHICO MENDES DE CONSERVACAODA BIODIVERSIDADE,PB,NÃO CONTRIBUINTE
10735145003029,INSTITUTO FEDERAL DE EDUCACAO CIENCIAE TECNOLOGIA DO MARANHA,MA,NÃO CONTRIBUINTE
9590106000248,4 BATALHAO DE COMUNICACOES,PE,NÃO CONTRIBUINTE
9585986000183,9. BATALHAO DE SUPRIMENTO,MS,NÃO CONTRIBUINTE
9655599000257,COMANDO DA FRONTEIRA ACRE 4 BIS,AC,NÃO CONTRIBUINTE
10882594001641,INSTITUTO FEDERAL DE SAO PAULO - CAMPUS PIRACICABA,SP,NÃO CONTRIBUINTE
1678363000143,INST. NACIONAL DE ESTUDOS E PESQUISAS,DF,CONTRIBUINTE ISENTO
24134488003042,DIRET.CENTRO DE FILOSOFIA E C.HUMANAS - UFPE,PE,CONTRIBUINTE ISENTO
26474056000767,SUPERINTENDENCIA DO IPHAN RIO DE JANEIRO-RJ,RJ,NÃO CONTRIBUINTE
9621924000260,10  DEPOSITO DE SUPRIMENTO - (FILIAL),CE,NÃO CONTRIBUINTE
9583363000171,12 BATALHAO DE SUPRIMENTO,AM,CONTRIBUINTE ISENTO
394544002200,CENTRO NACIONAL DE PRIMATAS,PA,NÃO CONTRIBUINTE
9596556000248,COMANDO DA 2 BRIGADA DE CAVALARIA MECANIZADA (724),RS,NÃO CONTRIBUINTE
10830301000520,"INSTITUTO FEDERAL DE EDUCACAO, CIENCIA E TECNOLOGIA DO SERTA",PE,NÃO CONTRIBUINTE
43711001204,DEPARTAMENTO NACIONAL DE OBRAS CONTRA AS SECAS,SE,NÃO CONTRIBUINTE
26989350053660,SUPERINTENDENCIA ESTADUAL DE RORAIMA,RR,NÃO CONTRIBUINTE
8829974003614,INST CHICO MENDES DE CONSERV DA BIODIV,RN,NÃO CONTRIBUINTE
394536006684,MINISTERIO DAS RELACOES EXTERIORES,RS,NÃO CONTRIBUINTE
4892707001930,DNIT-DEPARTAMENTO NACIONAL DE INFRAEST DE TRANSPORTES,BA,NÃO CONTRIBUINTE
24134488002747,UNIVERSIDADE FEDERAL DE PERNAMBUCO,PE,NÃO CONTRIBUINTE
4822500000160,CENTRO DE TECNOLOGIA DA INFORMACAO RENATO ARCHER- CTI,SP,NÃO CONTRIBUINTE
26989350052698,FUNDACAO NACIONAL DE SAUDE,MS,NÃO CONTRIBUINTE
10637926000570,INSTITUTO FEDERAL DE EDUCACAO CIENCIAE TECNOLOGIA DO RIO GRA,RS,NÃO CONTRIBUINTE
10952708000449,INSTITUTO FEDERAL DO RIO DE JANEIRO./ CAMPUS NILOPOLIS,RJ,NÃO CONTRIBUINTE
9545602000280,17A BASE LOGISTICA,RO,CONTRIBUINTE ISENTO
10817343001098,"INSTITUTO FED DE EDUCACAO, CIENCIA E TECNOLOGIA DE RONDONIA",RO,CONTRIBUINTE ISENTO
10313835000236,22 DEPÓSITO DE SUPRIMENTO,SP,CONTRIBUINTE ISENTO
9632016000191,17 BATALHAO DE FRONTEIRA,MS,NÃO CONTRIBUINTE
26994558000123,ADVOCACIA GERAL DA UNIAO,DF,NÃO CONTRIBUINTE
394460013715,MINISTERIO DA ECONOMIA,PR,CONTRIBUINTE ISENTO
10784782001122,INST.FED.MATO GROSSO/C.C.N.PARECIS,MT,CONTRIBUINTE ISENTO
3659166000617,INSTITUTO BRASILEIRO DO MEIO AMBIENTE E DOS R NATURAIS,CE,NÃO CONTRIBUINTE
75101873001404,UNIVERSIDADE TEC FED DO PARANA- CAMPUS SANTA HELENA,PR,CONTRIBUINTE ISENTO
9571230000185,POLICLINICA MILITAR DE NITEROI,RJ,CONTRIBUINTE ISENTO
29406625001454,AGENCIA NACIONAL DE MINERACAO,RO,NÃO CONTRIBUINTE
10635424001077,INSTITUTO FEDERAL DE EDUCACAO CIENCIA E,SC,NÃO CONTRIBUINTE
10015144000256,CENTRO DE EST.DE PES. R. FORTE DUQUE DE CAXIAS - C17,RJ,CONTRIBUINTE ISENTO
394460015920,SUPERITENDENCIA REGIONAL DA RECEITA FEDERAL DO BRASIL PRIM,DF,NÃO CONTRIBUINTE
9623258000208,HOSPITAL DE GUARNICAO DE TABATINGA,AM,NÃO CONTRIBUINTE
10626896001306,INSTITUTO FEDERAL DE EDUCACAO CIENCIA E TECNOLOGIA DE MG,MG,NÃO CONTRIBUINTE
9633719000134,16 ESQUADRAO DE CAVALARIA MECANIZADO,PR,NÃO CONTRIBUINTE
394452047169,SECRETARIA GERAL DO EXERCITO,DF,NÃO CONTRIBUINTE
9561190000271,ACADEMIA MILITAR DAS AGULHAS NEGRAS - AMAN - (FILIAL),RJ,NÃO CONTRIBUINTE
10838653000874,INSTITUTO FEDERAL DE EDUCACAO CIENCIA E TECNOLOGIA,ES,CONTRIBUINTE ISENTO
24098477000705,HOSP UNIV LAURO WANDERLEY/UFPB,PB,NÃO CONTRIBUINTE
17217985005335,UNIVERSIDADE FEDERAL DE MINAS GERAIS,MG,CONTRIBUINTE ISENTO
394452053304,COMANDO DO EXERCITO,DF,NÃO CONTRIBUINTE
13802028000194,SUPERINTENDENCIA DO DESENVOLVIMENTO DO CENTRO-OESTE,DF,NÃO CONTRIBUINTE
394536001887,MINISTERIO DAS RELACOES EXTERIORES,RJ,CONTRIBUINTE ISENTO
8829974002723,ICMBIO - INSTITUTO CHICO MENDES,PE,CONTRIBUINTE ISENTO
10626896000504,"INSTITUTO FEDERAL DE EDUCACAO, CIENCIA E TECNOLOGIA DE MINAS",MG,NÃO CONTRIBUINTE
394502011693,ESCOLA DE APRENDIZES MARINHEIROS DO CEARÁ,CE,NÃO CONTRIBUINTE
25944455000781,LAFIMPRO - UFV CAMPUS RIO PARANAIBA,MG,NÃO CONTRIBUINTE
10728444000797,"INSTITUTO FEDERAL DE EDUCACAO, CIENCIA E TECNOLOGIA DE SERGI",SE,NÃO CONTRIBUINTE
10830301000600,"INSTITUTO FEDERAL DE EDUCACAO, CIENCIA E TECNOLOGIA DO SERTA",PE,CONTRIBUINTE ISENTO
27136980000100,MINISTERIO DOS DIREITOS HUMANOS,DF,NÃO CONTRIBUINTE
375972001302,INSTITUTO NACIONAL DE COLONIZACAO E REFORMA AGRARIA,RS,NÃO CONTRIBUINTE
10284791000182,1 BATALHAO DE GUARDA,RJ,CONTRIBUINTE ISENTO
9613553000275,COUDELARIA DO RINCAO,RS,NÃO CONTRIBUINTE
9562477000135,16º BATALHÃO LOGÍSTICO,DF,CONTRIBUINTE ISENTO
9566807000241,21 GRUPO DE ARTILHARIA CAMPANHA,RJ,CONTRIBUINTE ISENTO
394460007588,DELEGACIA DA RFB EM PORTO VELHO,RO,NÃO CONTRIBUINTE
17217985001771,ESCOLA DE ARQUITETURA/UFMG,MG,CONTRIBUINTE ISENTO
10792928000967,IFAM- CAMPUS TABATINGA,AM,NÃO CONTRIBUINTE
11358294000144,3°REGIMENTO DE CARROS DE COMBATE,PR,CONTRIBUINTE ISENTO
394452011644,COMANDO DO EXERCITO,SP,NÃO CONTRIBUINTE
9517543000155,28º BATALHÃO LOGÍSTICO,MS,NÃO CONTRIBUINTE
10792928000614,IFAM - CAMPUS MANAUS DISTRITO INDUSTRIAL,AM,NÃO CONTRIBUINTE
9571694000272,COMANDO 14A BRIGADA DE INFANTARIA MOTORIZADA,SC,CONTRIBUINTE ISENTO
3659166002407,IBAMA - SUPERINTENDENCIA DE SAO PAULO/ SP(00601),SP,CONTRIBUINTE ISENTO
10194500000246,27 BATALHAO LOGISTICO,PR,NÃO CONTRIBUINTE
9586576000238,COMANDO DA 6 BRIGADA DE INFANTARIA BLINDADA,RS,NÃO CONTRIBUINTE
394544004172,DISTRITO SANITARIO ESPECIAL INDIGENA,PE,CONTRIBUINTE ISENTO
394460012239,DELEGACIA DA RECEITA FEDERAL DO BRASIL EM PRES PRUDENTE,SP,NÃO CONTRIBUINTE
375972002023,SUPERINTED ESTADUAL DO PIAUI-INCRA/SR-24 - 03082,PI,CONTRIBUINTE ISENTO
9562143000242,34 BATALHAO DE INFANTARIA MOTORIZADO,PR,NÃO CONTRIBUINTE
59311005942,COORDENACAO REGIONAL INTERIOR SUL-SC,SC,NÃO CONTRIBUINTE
24464109000229,UNIVERSIDADE FEDERAL DE ALAGOAS,AL,NÃO CONTRIBUINTE
10830301000104,INSTITUTO FEDERAL DE EDUCACAO CIENCIA E TECNOLOGIA DO SERTAO,PE,NÃO CONTRIBUINTE
9667195000283,36 BATALHAO DE INFANTARIA MECANIZADO.,MG,NÃO CONTRIBUINTE
25648387000207,UNIVERSIDADE FEDERAL DE UBERLANDIA,MG,NÃO CONTRIBUINTE
375972001132,INST NAC DE COLON E REF AGRARIA,PR,NÃO CONTRIBUINTE
5756246000101,MINISTERIO DA CIDADANIA,DF,NÃO CONTRIBUINTE
75101873000190,UNIVERSIDADE TECNOLOGICA FEDERAL DO PARANA,PR,NÃO CONTRIBUINTE
9580252000292,CENTRO DE EMBARCACOES DO COM. MIL.DA AMAZONIA,AM,NÃO CONTRIBUINTE
10197253000231,CENTRO DE INSTRUCAO DE OPERACOES ESPECIAIS,RJ,NÃO CONTRIBUINTE
394544003524,MINISTERIO DA SAUDE,MT,NÃO CONTRIBUINTE
59311004113,COORDENACAO REGIONAL ALTO PURUS,AC,NÃO CONTRIBUINTE
375972001809,INSTITUTO NACIONAL DE COLONIZAÇAO E REFORMA AGRARIA/RN,RN,NÃO CONTRIBUINTE
26474056003359,IPHAN - INSTITUTO DO PATRIMONIO HISTORICO E ARTISTICO NACION,ES,NÃO CONTRIBUINTE
394502038621,BASE DE FUZILEIROS NAVAIS DA ILHA DO GOVERNADOR,RJ,NÃO CONTRIBUINTE
