codigo,nome,uf,indicador
10727655000705,"INSTITUTO FEDERAL DE EDUCACAO, CIENCIA E TECNOLOGIA DO NORT",MG,CONTRIBUINTE ICMS
394460042812,GERÊNCIA REG. DE ADMINISTRAÇÃO DO ME - RONDÔNIA,RO,CONTRIBUINTE ISENTO
394460006930,INSPETORIA DA RECEITA FEDERAL EM PONTA PORA (3610),MS,NÃO CONTRIBUINTE
9635270000143,COMANDO DA 8 REGIAO MILITAR E 8 DIVISAO DO EXERCITO,PA,NÃO CONTRIBUINTE
9580957000200,1 REGIMENTO DE CAVALARIA MECANIZADO,RS,NÃO CONTRIBUINTE
10882594001056,IFSP - CAMPUS SAO JOAO DA BOA VISTA,SP,CONTRIBUINTE ISENTO
9559239000170,26 GRUPO DE ARTILHARIA DE CAMPANHA,PR,NÃO CONTRIBUINTE
9577042000164,47 BATALHAO DE INFANTARIA,MS,NÃO CONTRIBUINTE
9613736000100,COMANDO DE FRONTEIRA JURUÁ E 61 BIS,AC,NÃO CONTRIBUINTE
7552636000276,7 BATALHAO DE ENGENHARIA DE CONSTRUCAO,AC,CONTRIBUINTE ISENTO
394502054589,COMANDO DA MARINHA,RJ,NÃO CONTRIBUINTE
9622067000132,4 GRUPO DE ARTILHARIA ANTIAEREA - GAAE,MG,NÃO CONTRIBUINTE
29979036000221,GERENCIA EXECUTIVA DE MACEIO,AL,NÃO CONTRIBUINTE
9586718000186,5 BATALHAO DE ENG DE COMBATE BLINDADO,SC,NÃO CONTRIBUINTE
9562277000182,18 GRUPO DE ARTILHARIA DE CAMPANHA,MT,NÃO CONTRIBUINTE
10838653002060,INSTITUTO FEDERAL DO ESPIRITO SANTO CAMPUS MONTANHA,ES,CONTRIBUINTE ISENTO
10779511000964,"INSTITUTO FEDERAL DE EDUCACAO, CIENCIA E TECNOLOGIA FLUMINEN",RJ,NÃO CONTRIBUINTE
11402887001213,"INSTITUTO FEDERAL DE EDUCACAO, CIENCIA E TECNOLOGIA DE SANTA",SC,CONTRIBUINTE ISENTO
11402887000675,"INSTITUTO FEDERAL DE EDUCACAO, CIENCIA E(977)",SC,CONTRIBUINTE ISENTO
10635424001409,INSTITUTO FEDERAL DE EDUCACAO CIENCIA E TECNOLOGIA CATARINEN,SC,NÃO CONTRIBUINTE
10729992001037,"INST FED DE EDUC, CIENCIA E TEC. SUL-RIO-GRAND - RS",RS,CONTRIBUINTE ISENTO
9589084000204,5 GRUPO DE ARTILHARIA DE CAMPANHAAP - 11650,PR,NÃO CONTRIBUINTE
9601166000138,3° REGIMENTO DE CAVALARIA DE GUARDA - REGIMENTO OSORIO,RS,NÃO CONTRIBUINTE
394429016538,COMANDO DA AERONAUTICA,SP,NÃO CONTRIBUINTE
394544019870,SUPERINTENDENCIA ESTADUAL DO MS/SP (005941-0),SP,NÃO CONTRIBUINTE
4053755000105,OBSERVATORIO NACIONAL,RJ,CONTRIBUINTE ISENTO
394429007890,PABR,DF,NÃO CONTRIBUINTE
26989350000973,FUNDAÇÃO NACIONAL DA SAUDE-FUNASA,CE,NÃO CONTRIBUINTE
9631719000103,A 15 COMPANHIA DE ENGENHARIA DE COMBATE MECANIZADA,PR,NÃO CONTRIBUINTE
394429004955,COMANDO DA AERONAUTICA,RJ,NÃO CONTRIBUINTE
38166000954,BANCO CENTRAL DO BRASIL,SP,NÃO CONTRIBUINTE
9579927000100,REGIMENTO DE CAVALARIA MECANIZADA,MS,NÃO CONTRIBUINTE
9608238000179,1 BATALHAO DE INFANTARIA MOTORIZADO (ESCOLA),RJ,CONTRIBUINTE ISENTO
1263896003422,"MINISTERIO DA CIENCIA, TECNOLOGIA E INOVACOES",ES,NÃO CONTRIBUINTE
8829974003029,INST CHICO MENDES DE CONSERV DA BIODIVER,AL,NÃO CONTRIBUINTE
9572399000230,29 GRUPO DE ARTILHARIA DE C. AUTO PROPULSADO,RS,NÃO CONTRIBUINTE
394460009360,MINISTERIO DA FAZENDA,BA,NÃO CONTRIBUINTE
10637926001622,IFRS - CAMPUS ALVORADA,RS,NÃO CONTRIBUINTE
394429011900,BASE AEREA DE PORTO VELHO,RO,CONTRIBUINTE ISENTO
394429022775,COMANDO DA AERONAUTICA,AM,NÃO CONTRIBUINTE
10744098002199,INSTITUTO FEDERAL DE EDUCACAO CIENCIAE TECNOLOGIA DO CEARA,CE,NÃO CONTRIBUINTE
31543958000233,BASE ADMINISTRATIVA DO CURADO,PE,CONTRIBUINTE ISENTO
394460047105,DELEGACIA DA RECEITA FEDERAL DO BRASIL EM JUNDIAI,SP,NÃO CONTRIBUINTE
394445013939,MINISTERIO DA EDUCACAO,DF,NÃO CONTRIBUINTE
9579843000169,53 BATALHAO INFANTARIA DA SELVA,PA,NÃO CONTRIBUINTE
10635424000186,INSTITUTO FED. EDUCACAO CIENCIA E TECN. CATARINENS,SC,NÃO CONTRIBUINTE
10779511000611,INSTITUTO FEDERAL FLUMINENSE,RJ,NÃO CONTRIBUINTE
10300296000209,MUSEU HISTORICO DO EXERCITO E FORTE DE COPACABANA,RJ,NÃO CONTRIBUINTE
10806496000220,"INSTITUTO FEDERAL DE EDUCACAO, CIENCIA E TECNOLOGIA DO PIAUI",PI,NÃO CONTRIBUINTE
10626896000849,INTISTUTO FEDERAL DE MINAS GERAIS CAMPOS BETIM,MG,NÃO CONTRIBUINTE
8829974002995,INST CHICO MENDES DE CONSERV DA BIODIVER,SE,NÃO CONTRIBUINTE
394502044516,FRAGATA RADEMAKER,RJ,NÃO CONTRIBUINTE
10784782000665,"INSTITUTO FEDERAL DE EDUCACAO, CIENCIA E TECNOLOGIA DE MATO",MT,CONTRIBUINTE ISENTO
10763998001616,"INSTITUTO FEDERAL DE EDUCACAO, CIENCIA E TECNOLOGIA DO PARA",PA,CONTRIBUINTE ISENTO
2313673000127,AGENCIA NACIONAL DO PETROLEO GAS NATURAL E BIOCOMBUSTIVEIS,DF,NÃO CONTRIBUINTE
394460023516,MINISTERIO DA FAZENDA,MS,NÃO CONTRIBUINTE
394460023435,MINISTERIO DA FAZENDA,MT,NÃO CONTRIBUINTE
394460024164,MINISTERIO DA FAZENDA,RS,NÃO CONTRIBUINTE
10806496000300,"INSTITUTO FEDERAL DE EDUCACAO, CIENCIA E TECNOLOGIA DO PIAUI",PI,NÃO CONTRIBUINTE
394544002390,MINISTERIO DA SAUDE,DF,CONTRIBUINTE ISENTO
7129796000126,CENTRO GESTOR OPERACIONAL DO SISTEMA DE PROTEÇÃO DA AMAZÔNIA,DF,NÃO CONTRIBUINTE
29507878000361,COMISSAO DE VALORES MOBILIARIOS,DF,CONTRIBUINTE ISENTO
662270000168,"INSTITUTO NACIONAL DE METROLOGIA , QUALIDADE E TECNOLOGIA",PR,CONTRIBUINTE ISENTO
394445027301,INSTITUTO NACIONAL DE EDUCACAO DE SURDOS- RJ - C223,RJ,CONTRIBUINTE ISENTO
33781055000992,FIOCRUZ BRASILIA,DF,NÃO CONTRIBUINTE
1612452000197,MINISTERIO DO DESENVOLVIMENTO AGRARIO,DF,NÃO CONTRIBUINTE
59311007481,FUNAI-FUNDAÇÃO NACIONAL DO INDIO,AM,CONTRIBUINTE ISENTO
29507878000280,COMISSAO DE VALORES MOBILIARIOS (CVM),SP,CONTRIBUINTE ISENTO
10728444000282,INST.FED.DO SERGIPE/CAMPUS SAO CRISTOVAO,SE,NÃO CONTRIBUINTE
33781055002189,FUNDACAO OSWALDO CRUZ-FIOCRUZ,AM,NÃO CONTRIBUINTE
9517543000236,28 BATALHAO LOGISTICO,MS,NÃO CONTRIBUINTE
375972000322,INSTITUTO NACIONAL DE COLONIZACAO E REFORMA AGRARIA,PA,NÃO CONTRIBUINTE
9625886000214,9 GRUPO DE ARTILHARIA DE CAMPANHA,MS,NÃO CONTRIBUINTE
9633335000200,COMANDO 12º REGIAO MILITAR,AM,CONTRIBUINTE ISENTO
10562575000151,HOSPITAL GERAL DE SALVADOR,BA,CONTRIBUINTE ISENTO
394429002154,COLEGIO TENENTE REGO BARROS,PA,NÃO CONTRIBUINTE
29979036034398,INSTITUTO NACIONAL DO SEGURO SOCIAL,SP,NÃO CONTRIBUINTE
10735145001328,"INSTITUTO FEDERAL DE EDUCACAO, CIENCIA E TECNOLOGIA DO MARAN",MA,NÃO CONTRIBUINTE
9622228000198,BATALHAO DE MANUTENCAO E SUPRIMENTO DE ARMAMENTO - C18,RJ,CONTRIBUINTE ISENTO
5457283000704,MINISTERIO DO TURISMO,DF,CONTRIBUINTE ISENTO
394460013049,DELEGACIA DA RECEITA FEDERAL DO BRASIL EM OSASCO,SP,NÃO CONTRIBUINTE
10735145000437,INST. FED. DO MARANHAO CAMPUS BACABAL,MA,CONTRIBUINTE ISENTO
10792928001009,"INSTITUTO FEDERAL DE EDUCACAO, CIENCIA E TECNOLOGIA DO AMAZO",AM,CONTRIBUINTE ISENTO
394460023273,MINISTERIO DA FAZENDA,GO,NÃO CONTRIBUINTE
394460052885,MINISTERIO DA FAZENDA,RS,NÃO CONTRIBUINTE
9563579000256,CENTRO DE PREPARAÇÃO DE OFICIAIS DA RESERVA DE BH,MG,NÃO CONTRIBUINTE
394536001615,MINISTERIO DAS RELACOES EXTERIORES,PA,NÃO CONTRIBUINTE
394460013804,DELEGACIA DA RECEITA FEDERAL DO BRASIL DE CASCAVEL,PR,NÃO CONTRIBUINTE
3659166001770,IBAMA - SUPERINTENDENCIA DO RIO DE JANEIRO/RJ,RJ,NÃO CONTRIBUINTE
10652179000891,INSTITUTO FEDERAL DE EDUCACAO CIENCIAE TECNOLOGIA DO PARANA,PR,NÃO CONTRIBUINTE
17217985002158,UNIVERSIDADE FEDERAL MINAS GERAIS,MG,NÃO CONTRIBUINTE
7290290000102,SUPERINTENDENCIA NACIONAL DE PREVIDENCIA COMPLEMENTAR,DF,CONTRIBUINTE ISENTO
26989350000540,FUNDACAO NACIONAL DE SAUDE - PA,PA,NÃO CONTRIBUINTE
394460007669,MINISTERIO DA ECONOMIA,RR,CONTRIBUINTE ISENTO
10784782000746,"INSTITUTO FEDERAL DE EDUCACAO, CIENCIA E TECNOLOGIA DE MATO",MT,NÃO CONTRIBUINTE
10784782001556,"INSTITUTO FEDERAL DE EDUCACAO, CIENCIA E TECNOLOGIA DE MATO",MT,CONTRIBUINTE ISENTO
9593838000291,14. BATALHAO LOGISTICO,PE,NÃO CONTRIBUINTE
4892707002154,DEPARTAMENTO NACIONAL DE INFRAESTRUTURA DE TRANSPORTES - DNI,PE,NÃO CONTRIBUINTE
9540612000222,21 DEPOSITO DE SUPRIMENTO 21 D SUP,SP,NÃO CONTRIBUINTE
394452035233,DECIMO PRIMEIRO GRUPO DE ARTILHARIA DE CAMPANHA,RJ,CONTRIBUINTE ISENTO
394494015834,MINISTERIO DA JUSTICA E SEGURANCA PUBLICA,DF,CONTRIBUINTE ISENTO
10952708000520,"INSTITUTO FEDERAL DE EDUCACAO, CIENCIA E TECNOLOGIA DO RIO D",RJ,NÃO CONTRIBUINTE
9572828000270,COMANDO DA 12 BRIGADA DE INFANTARIA LEVE (AEROMOVEL),SP,NÃO CONTRIBUINTE
9536960000226,SEGUNDA BATERIA DE ARTILHARIA ANTIAEREA,RS,CONTRIBUINTE ISENTO
2030715000627,AGÊNCIA NACIONAL DE TELECOMUNICAÇÕES - PA,PA,NÃO CONTRIBUINTE
43711000577,DEPARTAMENTO NACIONAL DE OBRAS CONTRA AS SECAS,CE,NÃO CONTRIBUINTE
10744098001702,INSTITUTO FEDERAL DE EDUCACAO CIENC,CE,NÃO CONTRIBUINTE
10648539000539,"INSTITUTO FEDERAL DE EDUCACAO, CIENCIA E TECNOLOGIA DO SUL D",MG,CONTRIBUINTE ICMS
38166000369,BANCO CENTRAL DO BRASIL,MG,NÃO CONTRIBUINTE
9613461000295,8 DEPOSITO DE SUPRIMENTO,PA,NÃO CONTRIBUINTE
24134488000450,CENTRO ACADEMICO VITORIA DE SANTO ANTAO-UFPE,PE,NÃO CONTRIBUINTE
9536960000145,160434/00001 2 BATERIA DE ARTILHARIA ANTIAEREA,RS,CONTRIBUINTE ISENTO
10783898001309,IFPB/CAMPUS DE ESPERANÇA-PB,PB,CONTRIBUINTE ISENTO
10724903000179,"INSTITUTO FEDERAL DE EDUCAÇÃO, CIENCIA E TECNOLOGIA BAIANO",BA,CONTRIBUINTE ISENTO
10728444000525,INSTITUTO FEDERAL DE EDUC.CIEN.E TECNO.DE SERGIPE,SE,NÃO CONTRIBUINTE
394429005099,HOSPITAL DA FORCA AEREA DO GALEAO,RJ,CONTRIBUINTE ISENTO
394429001930,COMANDO DA AERONAUTICA,RJ,NÃO CONTRIBUINTE
375972009540,INSTITUTO NAC. COLONIZ. E REFORMA AGRARIA,TO,NÃO CONTRIBUINTE
26474056002700,INSTITUTO DO PATR HIST E ART. NACIONAL,DF,NÃO CONTRIBUINTE
10764307000708,INST FED DA BAHIA/CAMPUS SANTO AMARO,BA,NÃO CONTRIBUINTE
10207029000283,COMANDO DO COMANDO MILITAR DA AMAZONIA,AM,CONTRIBUINTE ISENTO
9631153000292,CENTRO DE PREPARACAO DE OFICIAIS DA RESERVA,PE,NÃO CONTRIBUINTE
10735145001670,"INST. FEDERAL DE EDUCACAO, CIENCIA E TECNOLOGIA DO MARANHAO",MA,NÃO CONTRIBUINTE
59311001289,COORD.REG.DE MINAS GERAIS E ESPIRITO SANTO/MG,MG,NÃO CONTRIBUINTE
26474056003278,IPHAN - INSTIT. DO PATRIM. HIST. E ART. NAC. NA PB,PB,CONTRIBUINTE ISENTO
9584352000106,3 COMPANHIA DE ENGENHARIA DE COMB. MECANIZADO,RS,NÃO CONTRIBUINTE
10882594001803,INSTITUTO FEDERAL DE SAO PAULO,SP,NÃO CONTRIBUINTE
10695891000444,INSTITUTO FEDERAL DO TRIANGULO MINEIRO CAMPUS ITUIUTABA,MG,NÃO CONTRIBUINTE
9565307000295,BASE ADMINISTRATIVA DA GUARNIÇÃO DE NATAL,RN,NÃO CONTRIBUINTE
11118393000159,UNIVERSIDADE  FEDERAL DO OESTE DO PARA,PA,CONTRIBUINTE ISENTO
26994558001448,ADVOCACIA GERAL DA UNIAO,GO,NÃO CONTRIBUINTE
9563296000204,13 GRUPO DE ARTILHARIA DE CAMPANHA,RS,CONTRIBUINTE ISENTO
59311006590,COORDENAÇÃO REG DO VALE DO JAVARI - AM,AM,CONTRIBUINTE ISENTO
83899526000506,UNIVERSIDADE FEDERAL DE SANTA CATARINA,SC,NÃO CONTRIBUINTE
10763998001705,"INSTITUTO FEDERAL DE EDUCACAO,CIENCIA E TECNOLOGIA DO PARA",PA,NÃO CONTRIBUINTE
10792928000452,"INSTITUTO FEDERAL DE EDUCACAO, CIENCIA E TECNOLOGIA DO AMAZO",AM,NÃO CONTRIBUINTE
21744847000231,BASE ADMINISTRATIVA QUARTEL GENERAL,DF,NÃO CONTRIBUINTE
26474056001062,INSTITUTO DO PATR HIST E ART NACIONAL,SP,NÃO CONTRIBUINTE
23612685002842,MINISTERIO DO TRABALHO E EMPREGO MTE BARRETOS,SP,NÃO CONTRIBUINTE
394460008045,DELEGACIA DA RECEITA FEDERAL DO BRASIL EM SAO LUIS MA,MA,CONTRIBUINTE ISENTO
26474056004320,SUPERINTENDENCIA DO IPHAN EM TOCANTINS,TO,NÃO CONTRIBUINTE
394429002235,COMANDO DA AERONAUTICA,PE,NÃO CONTRIBUINTE
394460014525,ALFANDEGA - RECEITA FEDERAL,PR,NÃO CONTRIBUINTE
42414284000617,COLÉGIO PEDRO II - CAMPUS NITEROI,RJ,NÃO CONTRIBUINTE
10763998000997,INST.FED.DO PARA/CAMPUS ABAETETUBA,PA,NÃO CONTRIBUINTE
10724903001060,INST. FED. BAIANO - CAMPUS URUÇUCA,BA,CONTRIBUINTE ISENTO
10735145000518,INSTITUTO FEDERAL DE EDUCACAO CIENCIAE TECNOLOGIA DO MARANHA,MA,NÃO CONTRIBUINTE
37115383000587,MINISTERIO DE MINAS E ENERGIA,DF,NÃO CONTRIBUINTE
394544018637,NUCLEO ESTADUAL DO MS MG,MG,NÃO CONTRIBUINTE
21182416000148,AGU MG - PSFGOVERNADOR VALADARES,MG,CONTRIBUINTE ISENTO
43711001115,DERUR-5 DISTRITO DE ENGENHARIA RURAL,MG,CONTRIBUINTE ISENTO
33663683006076,UFRJ - INSTITUTO DE CIÊNCIAS BIOMÉDICAS,RJ,CONTRIBUINTE ISENTO
9580391000216,20 GRUPO DE ARTILHARIA DE CAMPANHA,SP,CONTRIBUINTE ISENTO
394429020993,COMANDO DA AERONAUTICA ALA 6,RO,NÃO CONTRIBUINTE
14135659000240,BASE DE ADMINISTRACAO E APOIO DO CMP,DF,NÃO CONTRIBUINTE
10763998000300,INSTITUTO FEDERAL DE EDUCACAO CIENCIAE TECNOLOGIA DO PARA,PA,NÃO CONTRIBUINTE
60453032000840,UNIVERSIDADE FEDERAL DE SAO PAULO,SP,NÃO CONTRIBUINTE
4892707001506,DEPARTAMENTO NACIONAL DE INFRAESTDE TRANSPORTE,RN,NÃO CONTRIBUINTE
3659166001427,INSTITUTO BRASILEIRO DO MEIO AMBIENTE E DOS RECURSOS NATURAI,PA,NÃO CONTRIBUINTE
10779511000450,NST. FED. DE EDUC. CIEN. E TEC. FLUM. CAMPUS GUARUS,RJ,NÃO CONTRIBUINTE
10792928000703,"INSTITUTO FEDERAL DE EDUCACAO, CIENCIA E TECNOLOGI",AM,NÃO CONTRIBUINTE
10779511000700,INST. FED. FLUMINENSE CAMPUS ITAPERUNA,RJ,NÃO CONTRIBUINTE
9552638000100,ARSENAL DE GUERRA GENERAL CAMARA,RS,CONTRIBUINTE ISENTO
394460049744,MINISTERIO DA FAZENDA,PR,NÃO CONTRIBUINTE
394544019366,SUPERINTENDENCIA ESTADUAL DO MS/RN,RN,NÃO CONTRIBUINTE
9543440000240,167450/00001 - 14 REGIMENTO DE CAVALARIA MECANIZADO,SC,CONTRIBUINTE ISENTO
10838653001412,INSTITUTO FEDERAL DE EDUCACAO CIENCIA E TECNOLOGIA DO ESPIRI,ES,NÃO CONTRIBUINTE
17217985002662,FACULDADE DE LETRAS DA UFMG,MG,NÃO CONTRIBUINTE
10882594002109,"INSTITUTO FEDERAL DE EDUCAÇÃO, CIÊNCIA E TECNOLOGIA DE SP",SP,CONTRIBUINTE ISENTO
10673078000988,INSTITUTO FEDERAL DE MS -CAMPUS JARDIM,MS,NÃO CONTRIBUINTE
1175497001628,AGENCIA BRASILEIRA DE INTELIGENCIA,AC,NÃO CONTRIBUINTE
1175497000737,AGENCIA BRASILEIRA DE INTELIGENCIA-ABIN/GSI/PR,SC,NÃO CONTRIBUINTE
10882594000750,"INSTITUTO FEDERAL DE EDUCAÇÃO, CIENCIA E TECNOLOGIA DE SÃO P",SP,CONTRIBUINTE ISENTO
662197000124,FUNDACAO ALEXANDRE DE GUSMAO,DF,NÃO CONTRIBUINTE
394460052532,MINISTERIO DA ECONOMIA,MG,CONTRIBUINTE ISENTO
394460028313,MINISTERIO DA FAZENDA,MG,NÃO CONTRIBUINTE
394460051994,MINISTERIO DA ECONOMIA SC,SC,CONTRIBUINTE ISENTO
394460022706,MINISTERIO DA FAZENDA,SC,NÃO CONTRIBUINTE
394460049906,MINISTERIO DA FAZENDA,SC,NÃO CONTRIBUINTE
10763998000210,INST. FED. DE EDU. CIENCIA E TEC. DO PARA - IFPA,PA,NÃO CONTRIBUINTE
394429005170,COMANDO DA AERONAUTICA,RJ,NÃO CONTRIBUINTE
4903587000361,AGENCIA NACIONAL DE TRANSPORTES AQUAVIARIOS,SC,NÃO CONTRIBUINTE
402552000983,COMISSAO NACIONAL DE ENERGIA NUCLEAR,GO,CONTRIBUINTE ISENTO
394536000481,MINISTERIO DAS RELACOES EXTERIORES - MRE,DF,CONTRIBUINTE ISENTO
12678115000119,COLEGIO MILITAR DE CURITIBA,PR,NÃO CONTRIBUINTE
394460022463,MINISTERIO DA FAZENDA,MG,NÃO CONTRIBUINTE
394429009086,COMANDO DA AERONAUTICA,PA,NÃO CONTRIBUINTE
1175497002357,AGENCIA BRASILEIRA DE INTELIGENCIA,RN,NÃO CONTRIBUINTE
10830301000791,INSTITUTO FEDERAL DE EDUCACAO CIENCIAE TECNOLOGIA DO SERTAO,PE,NÃO CONTRIBUINTE
394460008550,DELEGACIA DA RECEITA FEDERAL DO BRASIL,RN,NÃO CONTRIBUINTE
9538279000217,58 BATALHAO DE INFANTARIA MOTORIZADO - 12191,GO,NÃO CONTRIBUINTE
24134488002666,UNIVERSIDADE FEDERAL DE PERNAMBUCO,PE,NÃO CONTRIBUINTE
9595886000219,COMANDO DA 4A BDA DE INFANTARIA LEVE MONTANHA,MG,NÃO CONTRIBUINTE
9263130000191,SUPERINTENDENCIA DO DESENVOLVIMENTO DO NORDESTE - SUDENE,PE,NÃO CONTRIBUINTE
26474056001143,INSTITUTO DO PATRIMONIO HISTORICO E ARTISTICO NACIONAL,PR,NÃO CONTRIBUINTE
10898596002862,INSTITUTO BRASILEIRO DE MUSEUS - IB,RJ,NÃO CONTRIBUINTE
10898596002781,INSTITUTO BRASILEIRO DE MUSEUS - IBRAM,RJ,NÃO CONTRIBUINTE
9573253000200,15 BATALHAO DE INFANTARIA MOTORIZADO,PB,NÃO CONTRIBUINTE
11402887001051,INSTITUTO FEDERAL DE EDUC.CIÊNCIA E TEC. DE SANTA CATARINA,SC,CONTRIBUINTE ISENTO
23612685002508,MINISTERIO DO TRABALHO,SE,NÃO CONTRIBUINTE
26994558000395,ADVOCACIA GERAL DA UNIAO - AGU,DF,CONTRIBUINTE ISENTO
37294496000244,CENTRO DE LOGISTICA DE MISSEIS E FOGUETE,GO,NÃO CONTRIBUINTE
10783898001147,"INSTITUTO FED DE EDUCACAO, CIENCIA E TECN DA PARAIBA",PB,NÃO CONTRIBUINTE
10673078000635,"INSTITUTO FEDERAL DE EDUCACAO, CIENCIA E TECNOLOGIA DE MATO",MS,NÃO CONTRIBUINTE
26994558006679,ADVOCACIA GERAL DA UNIAO,DF,NÃO CONTRIBUINTE
9646169000279,2 GRUPO DE ARTILHARIA DE CAMAPNHA LEVE,SP,NÃO CONTRIBUINTE
28890858000198,COMISSAO REGIONAL DE OBRAS DA 8 REGIAO MILITAR,PA,NÃO CONTRIBUINTE
10695891000959,IFTM- MG -CAMPUS PATROCÍNIO,MG,NÃO CONTRIBUINTE
42414284001427,COLEGIO PEDRO II,RJ,NÃO CONTRIBUINTE
29979036010707,INSTITUTO NACIONAL DO SEGURO SOCIAL GEX GOVERNADOR VALADARES,MG,NÃO CONTRIBUINTE
9539549000123,4º CENTRO DE GEOINFORMAÇÃO,AM,NÃO CONTRIBUINTE
26989350001783,FUNDAÇÃO NACIONAL DE SAÚDE - BA,BA,NÃO CONTRIBUINTE
26994558001790,ADVOCACIA GERAL DA UNIAO,MG,NÃO CONTRIBUINTE
10014999000262,COMANDO DO COMANDO MILITAR DO LESTE,RJ,NÃO CONTRIBUINTE
29406625000997,AGENCIA NACIONAL DE MINERACAO,SC,NÃO CONTRIBUINTE
10877412001725,INST FED RN / CAMPUS SAO PAULO DO POTENGI,RN,NÃO CONTRIBUINTE
16888315000238,UFVJM CAMPUS MUCURI,MG,NÃO CONTRIBUINTE
9658166000174,111 CIA DE APOIO DE MATERIAL BELICO,RJ,NÃO CONTRIBUINTE
10637926001703,INSTITUTO FEDERAL IFRS - CAMPUS DE VIAMAO-1081,RS,NÃO CONTRIBUINTE
394429004874,DEPTO DE CONTROLE DO ESPACO AEREO,RJ,CONTRIBUINTE ISENTO
9605781000201,17 GRUPO DE ARTILHARIA DE CAMPANHA,RN,NÃO CONTRIBUINTE
3659166000536,SUPERINTENDENCIA DO AMAPA,AP,CONTRIBUINTE ISENTO
10767239001540,INSTITUTO FEDERAL DE PERNAMBUCO - CAMPUS PAULISTA,PE,NÃO CONTRIBUINTE
9614792000169,DECIMO ESQUADRAO DE CAVALARIA MECAN,PE,NÃO CONTRIBUINTE
394460011348,"DELEGACIA DA RECEITA FEDERAL DO BRASIL EM VITORIA, ES",ES,CONTRIBUINTE ISENTO
10735145002057,"INSTITUTO FEDERAL DE EDUCACAO, CIENCIA E TECNOLOGIA",MA,CONTRIBUINTE ISENTO
38174000658,FUNDACAO UNIVERSIDADE DE BRASILIA,DF,NÃO CONTRIBUINTE
12678115000208,8733355-COLEGIO MILITAR DE CURITIBA,PR,NÃO CONTRIBUINTE
394502034200,COMANDO DA MARINHA BR,RJ,CONTRIBUINTE ISENTO
394460051560,PROCURADORIA SECCIONAL DA FAZENDA NACIONAL EM PI,PR,CONTRIBUINTE ISENTO
9552692000236,QUINTA REGIAO MILITAR,PR,NÃO CONTRIBUINTE
9593769000135,COMANDO DA 10 BRIGADA DE INFANTARIA MOTORIZADA,PE,NÃO CONTRIBUINTE
37115383000404,MINISTERIO DE MINAS E ENERGIA,DF,CONTRIBUINTE ISENTO
7524768000294,1 BATALHAO DE ENGENHARIA DE CONSTRUCAO,RN,NÃO CONTRIBUINTE
42414284000889,COLEGIO PEDRO II,RJ,NÃO CONTRIBUINTE
9687482000255,CENTRO DE AVALIACAO DO EXERCITO,RJ,NÃO CONTRIBUINTE
10767239000811,"INSTITUTO FED DE EDUC, CIENCIA E TECN DE PERNAMBUCO",PE,NÃO CONTRIBUINTE
43711000739,DNOCS CEST BA,BA,NÃO CONTRIBUINTE
10882594000599,INSTITUTO FEDERAL DE EDUCAÇÃO CIENCIA E TECNOLOGIA DE SP,SP,CONTRIBUINTE ISENTO
394544003877,DISTRITO SANITARIO ESPECIAL INDIGENA ARAGUAIA,MT,NÃO CONTRIBUINTE
394460007235,DELEGACIA DA RECEITA FEDERAL DO BRASIL EM MANAUS,AM,NÃO CONTRIBUINTE
26994558001103,PROCURADORIA DA UNIAO NO ESTADO DO AMAPA (PU/AP),AP,NÃO CONTRIBUINTE
396895000125,"MINISTERIO DA AGRICULTURA, PECUARIA E ABASTECIMENTO",DF,CONTRIBUINTE ISENTO
26994558001286,ADVOCACIA GERAL DA UNIAO,AM,NÃO CONTRIBUINTE
9614209000209,PARQUE REGIONAL DE MANUTENCAO/7,PE,NÃO CONTRIBUINTE
29979036040525,INSTITUTO NACIONAL DO SEGURO SOCIAL,SP,NÃO CONTRIBUINTE
17217985001186,CENTRO ESPORTIVO UNIVERSITARIO UFMG - CEU,MG,NÃO CONTRIBUINTE
394429001506,COMANDO DA AERONAUTICA,RJ,NÃO CONTRIBUINTE
4892707000704,DNIT-DEPARTAMENTO NACIONAL DE INFRAESTRUT DE TRANSPORTES,RO,NÃO CONTRIBUINTE
394429007628,COMANDO DA AERONAUTICA,RJ,NÃO CONTRIBUINTE
10763998001373,INST. FED. DO PARA/CAMPUS BREVES,PA,NÃO CONTRIBUINTE
10486016000290,12 BATALHAO DE INFANTARIA,MG,NÃO CONTRIBUINTE
26474056003006,INSTITUTO DO PATRIMONIO HISTORICO E ARTISTICO NACIONAL,DF,NÃO CONTRIBUINTE
9658026000104,10º BIL - CFGS,MG,NÃO CONTRIBUINTE
83899526000697,UNIVERSIDADE FEDERAL DE SANTA CATARINA,SC,NÃO CONTRIBUINTE
17217985002239,UNIVERSIDADE FEDERAL DE MINAS GERAIS,MG,NÃO CONTRIBUINTE
394460028909,MINISTÉRIO DA ECONOMIA-MF SECRETARIA DO TESOURO NACIONAL STN,DF,CONTRIBUINTE ISENTO
9547457000276,NONO REGIMENTO DE CAVALARIA BLINDADO,RS,NÃO CONTRIBUINTE
9575541000201,ESCOLA DE SARGENTOS DAS ARMAS *,MG,NÃO CONTRIBUINTE
9598288000201,COMANDO DA 7 REGIAO MILITAR/ 7 DIV DE EXERCITO,PE,NÃO CONTRIBUINTE
9549242000103,COMANDO DA 9A. REGIAO MILITAR,MS,NÃO CONTRIBUINTE
9633726000217,COMANDO 8 BRIGADA DE INFANTARIA MOTORIZADA,RS,CONTRIBUINTE ISENTO
375972001728,INST.NAC.DE COL.REF.AGRARIA,AC,NÃO CONTRIBUINTE
394452026242,COMANDO DA 9 REGIAO MILITAR,MS,CONTRIBUINTE ISENTO
9574722000205,GRAFICA DO EXERCITO,DF,NÃO CONTRIBUINTE
489828000902,MINISTERIO DO PLANEJAMENTO ORCAMENTO E N.FANT: SECRETARIA DO,DF,NÃO CONTRIBUINTE
11803735000250,3 BATALHAO DE INFANTARIA DE SELVA,AM,NÃO CONTRIBUINTE
4052955000143,LABORATORIO NACIONAL DE ASTROFISICA - LNA,MG,NÃO CONTRIBUINTE
394544019102,MINISTERIO DA SAUDE,PI,NÃO CONTRIBUINTE
10898596001971,INSTITUTO BRASILEIRO DE MUSEUS - IB,MG,NÃO CONTRIBUINTE
10898596000657,INSTITUTO BRASILEIRO DE MUSEUS - IB,RJ,NÃO CONTRIBUINTE
10898596001700,INS BRASILEIRO DE MUSEUS IBRAM,RJ,NÃO CONTRIBUINTE
10898596002439,MUSEU CASA BENJAMIM CONSTANT,RJ,NÃO CONTRIBUINTE
394502010530,BASE NAVAL DO RIO DE JANEIRO,RJ,NÃO CONTRIBUINTE
394502034391,BASE DE ABASTECIMENTO DA MARINHA NO RIO DE JANEIRO,RJ,CONTRIBUINTE ISENTO
75095679001110,UNIVERSIDADE FEDERAL DO PARANA,PR,CONTRIBUINTE ICMS
38166000601,BANCO CENTRAL DO BRASIL,RS,NÃO CONTRIBUINTE
10918674000204,IFAC - CAMPUS TARAUACA,AC,NÃO CONTRIBUINTE
33781055007148,EDITORA FIOCRUZ FUNDACAO OSWALDO CRUZ,RJ,CONTRIBUINTE ICMS
11402887001990,CAMPUS JARAGUA DO SUL- RAU,SC,CONTRIBUINTE ISENTO
2030715000970,AGENCIA NACIONAL DE TELECOMUNICACOES - ANATEL PR,PR,CONTRIBUINTE ISENTO
9582773000289,SETIMO BATALHAO DE INFANTARIA BLINDADO,RS,NÃO CONTRIBUINTE
394429000704,COMANDO DA AERONAUTICA,MS,NÃO CONTRIBUINTE
394536001453,INSTITUTO RIO BRANCO (IRBR),DF,NÃO CONTRIBUINTE
394429009914,COMANDO DA AERONAUTICA,RJ,NÃO CONTRIBUINTE
394502005022,COMANDO DA MARINHA CCEM,SP,NÃO CONTRIBUINTE
9660364000253,BATALHAO ESCOLA DE COMUNICACOES,RJ,NÃO CONTRIBUINTE
9613799000247,10 REGIMENTO DE CAVALARIA MECANIZADA,MS,NÃO CONTRIBUINTE
394452018908,MIN.DO EXERCITO CMDO - CML.,RJ,CONTRIBUINTE ISENTO
11402887000756,INSTITUTO FEDERAL DE ED. CIENCIA E TECNOLOGIA DE SANTA CATAR,SC,NÃO CONTRIBUINTE
10637926001118,INSTITUTO FED. DO RS/CAMPUS FARROUPILHA,RS,NÃO CONTRIBUINTE
394502041762,COMANDO DO 7 DISTRITO NAVAL              - 002750,DF,NÃO CONTRIBUINTE
394460035280,MINISTERIO DA FAZENDA,RJ,NÃO CONTRIBUINTE
10882519000285,PARQUE REGIONAL DE MANUTENCAO DA 6. REGIAO MILITAR,BA,NÃO CONTRIBUINTE
10626896000920,"INSTITUTO FEDERAL DE EDUCACAO, CIENCIA E TECNOLOGIA DE MINAS",MG,NÃO CONTRIBUINTE
10882594000912,IFSP - CAMPUS GUARULHOS,SP,NÃO CONTRIBUINTE
10637926000812,INSTITUTO FEDERAL DO RS/ CAMPUS RESTINGA,RS,NÃO CONTRIBUINTE
33787094000654,FUNDACAO INSTITUTO BRASILEIRO DE GEOLOGIA E ESTATISTICA,AM,NÃO CONTRIBUINTE
394460040879,MINISTERIO DA FAZENDA,DF,NÃO CONTRIBUINTE
9584021000257,6 BATALHAO DE COMUNICACAO DIVISIONARIO,RS,NÃO CONTRIBUINTE
38166000873,BANCO CENTRAL DO BRASIL,BA,NÃO CONTRIBUINTE
9943373000170,5 ESQUADRAO DE CAVALARIA MECANIZADO,PR,NÃO CONTRIBUINTE
394460024245,MINISTERIO DA FAZENDA,RJ,NÃO CONTRIBUINTE
10635424001158,INSTITUTO FEDERAL DE EDUCACAO CIENCIAE TECNOLOGIA CATARINENS,SC,NÃO CONTRIBUINTE
17217985000457,UNIVERSIDADE FEDERAL DE MINAS GERAIS,MG,NÃO CONTRIBUINTE
394460052966,MINISTERIO DA FAZENDA,RJ,NÃO CONTRIBUINTE
5478625000187,SECRETARIA DE DIREITOS HUMANOS,DF,NÃO CONTRIBUINTE
9203665000177,SUPERINTENDÊNCIA DO DESENVOLVIMENTO DA AMAZÔNIA - SUDAM,PA,NÃO CONTRIBUINTE
489828003928,"MINISTERIO DO PLANEJAMENTO, DESENVOLVIMENTO E GESTAO - MPDG",TO,NÃO CONTRIBUINTE
394460012905,MINISTERIO DA FAZENDA,SP,NÃO CONTRIBUINTE
10898596002609,INSTITUTO BRASILEIRO DE MUSEUS - MUSEU CASA HISTORICA DE,MA,NÃO CONTRIBUINTE
9559304000249,BASE DE ADM E APOIO DO CMDO MILITAR DO OESTE,MS,NÃO CONTRIBUINTE
2030715001003,37 - AGENCIA NACIONAL DE TELECOMUNICACOES,GO,NÃO CONTRIBUINTE
9584407000269,SEXTO GRUPO DE ARTILHARIA DE CAMPANHA,RS,CONTRIBUINTE ISENTO
394544019951,MINISTERIO DA SAUDE,SE,NÃO CONTRIBUINTE
9530655000227,667 - 15 GRUPO DE ARTILHARIA DE CAMPANHA AUTOPROPULSADO - 15,PR,NÃO CONTRIBUINTE
9603175000168,1º ESQUADRÃO DE CAVALARIA LEVE,RJ,NÃO CONTRIBUINTE
10806496001544,INST. FED DE EDUC. CIENCIA E TECN. DO PI,PI,NÃO CONTRIBUINTE
10342197000281,5 BATALHAO DE SUPRIMENTO,PR,NÃO CONTRIBUINTE
9543601000204,ESCOLA DE INSTRUCAO ESPECIALIZADA,RJ,CONTRIBUINTE ISENTO
59311006167,FUNDACAO NACIONAL DO INDIO,MT,NÃO CONTRIBUINTE
24134488002828,UNIVERSIDADE FEDERAL DE PERNAMBUCO - CCJ,PE,NÃO CONTRIBUINTE
10744098002270,INST. FEDERAL DE EDUC. E TECNOLOGIA DO CEARÁ- UBAJARA,CE,CONTRIBUINTE ISENTO
9547338000213,7 DEPOSITO DE SUPRIMENTO,PE,NÃO CONTRIBUINTE
9564970000194,13 BATALHAO DE INFANTARIA BLINDADA,PR,NÃO CONTRIBUINTE
375972002457,SUPERINTENDENCIA REGIONAL DE RO - INCRA,RO,CONTRIBUINTE ISENTO
17217985004606,PRO REITORIA DE PESQUISA UFMG,MG,NÃO CONTRIBUINTE
7517504000203,1 BATALHAO FERROVIARIO,SC,NÃO CONTRIBUINTE
9586924000277,DEPOSITO CENTRAL DE MUNICAO,RJ,NÃO CONTRIBUINTE
17217985005769,BIBLIOTECA UNIVERSITARIA UFMG,MG,NÃO CONTRIBUINTE
394452051352,COMANDO DE INFANTARIA AMAPA/34 BIS,AP,NÃO CONTRIBUINTE
394429001778,COM.AER.BASE AEREA DE SAO PAULO BASP,SP,NÃO CONTRIBUINTE
10174586000245,50 BATALHÃO DE INFANTARIA DE SELVA,MA,CONTRIBUINTE ISENTO
9561187000177,COLEGIO MILITAR DO RIO DE JANEIRO,RJ,CONTRIBUINTE ISENTO
394544018394,MINISTERIO DA SAUDE,MA,NÃO CONTRIBUINTE
10724903001574,INSTITUTO FEDERAL DE EDUCACAO CIENCIAE TECNOLOGIA BAIANO,BA,NÃO CONTRIBUINTE
9549096000116,COLEGIO MILITAR DE CAMPO GRANDE,MS,NÃO CONTRIBUINTE
9612844000249,6047895-2 BATALHAO DE INFANTARIA DE SELVA,PA,NÃO CONTRIBUINTE
394452047592,BASE DE APOIO LOGISTICO DO EXRERCITO,RJ,CONTRIBUINTE ICMS
10825373001046,"INSTITUTO FEDERAL DE EDUCACAO, CIENCIA E TECNOLOGIA DE ALAGO",AL,NÃO CONTRIBUINTE
394452055420,COMANDO DO EXERCITO,PE,NÃO CONTRIBUINTE
9591691000209,POLICLINICA MILITAR DO RIO DE JANEIRO,RJ,NÃO CONTRIBUINTE
10792928001424,"INSTITUTO FEDERAL DE EDUC, CIENCIA E TECN DO AMAZONAS",AM,NÃO CONTRIBUINTE
10284791000263,PRIMEIRO BATALHAO DE GUARDAS,RJ,CONTRIBUINTE ISENTO
37115367001485,MINISTERIO DO TRABALHO E EMPREGO MTE,ES,NÃO CONTRIBUINTE
26474056000848,INSTITUTO DO PATRIMONIO HISTORICO E ARTISTICO NACIONAL,BA,NÃO CONTRIBUINTE
9632026000208,COMANDO DA 18 BRIGADA DE INFANTARIA RONTEIRA,MS,NÃO CONTRIBUINTE
